-- phpMyAdmin SQL Dump
-- version 5.2.1
-- https://www.phpmyadmin.net/
--
-- Host: 127.0.0.1:3306
-- Generation Time: Sep 12, 2023 at 01:45 PM
-- Server version: 5.7.43
-- PHP Version: 7.4.33

SET SQL_MODE = "NO_AUTO_VALUE_ON_ZERO";
START TRANSACTION;
SET time_zone = "+00:00";


/*!40101 SET @OLD_CHARACTER_SET_CLIENT=@@CHARACTER_SET_CLIENT */;
/*!40101 SET @OLD_CHARACTER_SET_RESULTS=@@CHARACTER_SET_RESULTS */;
/*!40101 SET @OLD_COLLATION_CONNECTION=@@COLLATION_CONNECTION */;
/*!40101 SET NAMES utf8mb4 */;

--
-- Database: `bettergl_ipr`
--

-- --------------------------------------------------------

--
-- Table structure for table `failed_jobs`
--

CREATE TABLE `failed_jobs` (
  `id` bigint(20) UNSIGNED NOT NULL,
  `connection` text COLLATE utf8mb4_unicode_ci NOT NULL,
  `queue` text COLLATE utf8mb4_unicode_ci NOT NULL,
  `payload` longtext COLLATE utf8mb4_unicode_ci NOT NULL,
  `exception` longtext COLLATE utf8mb4_unicode_ci NOT NULL,
  `failed_at` timestamp NOT NULL DEFAULT CURRENT_TIMESTAMP
) ENGINE=InnoDB DEFAULT CHARSET=utf8mb4 COLLATE=utf8mb4_unicode_ci;

-- --------------------------------------------------------

--
-- Table structure for table `images`
--

CREATE TABLE `images` (
  `id` bigint(20) UNSIGNED NOT NULL,
  `todo_id` bigint(20) UNSIGNED NOT NULL,
  `image` varchar(255) COLLATE utf8mb4_unicode_ci DEFAULT NULL,
  `created_at` timestamp NULL DEFAULT NULL,
  `updated_at` timestamp NULL DEFAULT NULL
) ENGINE=InnoDB DEFAULT CHARSET=utf8mb4 COLLATE=utf8mb4_unicode_ci;

--
-- Dumping data for table `images`
--

INSERT INTO `images` (`id`, `todo_id`, `image`, `created_at`, `updated_at`) VALUES
(383, 377, 'CamScanner 01-25-2021 15.33_2.pdf', '2021-01-25 18:28:14', '2021-01-25 18:28:14'),
(384, 378, 'IMG-20210125-WA0020[1].jpg', '2021-01-26 05:24:36', '2021-01-26 05:24:36'),
(385, 382, 'MOTORBIKE-SUITS-QUOTATION.pdf', '2021-01-26 14:00:47', '2021-01-26 14:00:47'),
(386, 380, 'CamScanner 01-27-2021 07.48.pdf', '2021-01-27 06:09:33', '2021-01-27 06:09:33'),
(387, 389, 'BETTERGLOBE_QUOTE_27TH_JAN_2021[1].pdf', '2021-01-28 04:44:53', '2021-01-28 04:44:53'),
(388, 391, 'Jay-Kay-Quote.jpeg', '2021-01-28 10:51:55', '2021-01-28 10:51:55'),
(389, 392, 'Brush 2nches.jpg', '2021-01-28 13:08:51', '2021-01-28 13:08:51'),
(390, 392, 'Computer Cleaning Cloth.jpg', '2021-01-28 13:08:51', '2021-01-28 13:08:51'),
(391, 392, 'Hand Boss form.jpg', '2021-01-28 13:08:51', '2021-01-28 13:08:51'),
(392, 393, 'Bikes 20210128.pdf', '2021-01-29 05:53:55', '2021-01-29 05:53:55'),
(393, 393, 'MOTORBIKES BREAKDOWN AS AT 20210128 DKL.xlsx', '2021-01-29 05:53:55', '2021-01-29 05:53:55'),
(394, 398, 'Machines breakdown reporting 20201112.xlsx', '2021-01-31 04:42:46', '2021-01-31 04:42:46'),
(395, 399, 'Machines breakdown reporting 20201112.xlsx', '2021-01-31 04:55:50', '2021-01-31 04:55:50'),
(396, 400, 'Raincoats sizes.xlsx', '2021-01-31 05:00:00', '2021-01-31 05:00:00'),
(397, 405, '20210201-215114_p0[1].jpg', '2021-02-01 18:54:56', '2021-02-01 18:54:56'),
(398, 406, 'CamScanner 02-02-2021 08.22.pdf', '2021-02-02 06:54:10', '2021-02-02 06:54:10'),
(399, 407, 'Drinking Water.pdf', '2021-02-02 07:45:56', '2021-02-02 07:45:56'),
(400, 408, 'BETTER GLOBE FORESTRY-Raincoats.pdf', '2021-02-02 13:26:03', '2021-02-02 13:26:03'),
(401, 409, 'Fuel 20210202.pdf', '2021-02-02 18:44:25', '2021-02-02 18:44:25'),
(402, 415, 'Mabati_Quote.pdf', '2021-02-03 09:32:29', '2021-02-03 09:32:29'),
(403, 410, 'Diesel.pdf', '2021-02-03 11:31:35', '2021-02-03 11:31:35'),
(404, 411, 'Petrol-Motorbikes-Feb.pdf', '2021-02-03 11:35:19', '2021-02-03 11:35:19'),
(405, 416, 'Est_614_from_CAPTURE_SOLUTIONS_LTD_9828.pdf', '2021-02-03 12:37:38', '2021-02-03 12:37:38'),
(406, 417, 'muskir quot.jpg', '2021-02-04 12:16:44', '2021-02-04 12:16:44'),
(407, 418, 'Water dispenser 20210204.pdf', '2021-02-04 14:06:45', '2021-02-04 14:06:45'),
(408, 419, 'Latrine painting.pdf', '2021-02-04 14:19:07', '2021-02-04 14:19:07'),
(409, 421, 'Justification for the Laravel Daily Yearly subscription.docx', '2021-02-06 14:13:28', '2021-02-06 14:13:28'),
(410, 425, '20210208-222227_p0.jpg', '2021-02-08 19:52:14', '2021-02-08 19:52:14'),
(411, 426, '20210208-222316_p0.jpg', '2021-02-08 20:18:47', '2021-02-08 20:18:47'),
(412, 427, '20210208-222316_p0.jpg', '2021-02-08 20:23:55', '2021-02-08 20:23:55'),
(413, 429, 'Training Budget, Adobe.PNG', '2021-02-09 06:26:03', '2021-02-09 06:26:03'),
(414, 429, 'TRAINING QUOTE.PDF', '2021-02-09 06:26:03', '2021-02-09 06:26:03'),
(415, 430, 'Postage new rates.PNG', '2021-02-09 06:33:44', '2021-02-09 06:33:44'),
(416, 431, 'Postage new rates.PNG', '2021-02-09 06:35:47', '2021-02-09 06:35:47'),
(417, 434, 'supplier ID.pdf', '2021-02-09 08:45:29', '2021-02-09 08:45:29'),
(418, 445, 'Water dispenser 20210204.pdf', '2021-02-11 09:49:27', '2021-02-11 09:49:27'),
(419, 446, 'Water dispenser 20210204.pdf', '2021-02-11 09:51:05', '2021-02-11 09:51:05'),
(420, 450, '20210214-111247_p1.jpg', '2021-02-14 08:51:24', '2021-02-14 08:51:24'),
(421, 451, '20210214-111247_p0.jpg', '2021-02-14 09:48:42', '2021-02-14 09:48:42'),
(422, 452, 'IMG-20210212-WA0002.jpg', '2021-02-14 10:14:38', '2021-02-14 10:14:38'),
(423, 453, '20210214-111247_p0.jpg', '2021-02-14 20:24:40', '2021-02-14 20:24:40'),
(424, 455, 'Battery.png', '2021-02-15 18:38:12', '2021-02-15 18:38:12'),
(425, 456, 'BETTER GLOBE BATTERY.pdf', '2021-02-16 14:20:54', '2021-02-16 14:20:54'),
(426, 458, 'Fuel 20210216.pdf', '2021-02-16 14:53:03', '2021-02-16 14:53:03'),
(427, 459, 'Glyphosate proforma.pdf', '2021-02-16 15:06:36', '2021-02-16 15:06:36'),
(428, 461, 'RIMS_QUOTATION(1).pdf', '2021-02-17 06:22:43', '2021-02-17 06:22:43'),
(429, 466, 'Machines breakdown reporting 20201112.xlsx', '2021-02-17 14:56:35', '2021-02-17 14:56:35'),
(430, 467, 'BrushCutter-Quotation.jpg', '2021-02-17 17:25:12', '2021-02-17 17:25:12'),
(431, 468, 'BETTER GLOBE MF268&275XTRA-Amended.pdf', '2021-02-17 18:00:50', '2021-02-17 18:00:50'),
(432, 469, 'Hp spec.JPG', '2021-02-17 18:21:37', '2021-02-17 18:21:37'),
(433, 469, 'hp.JPG', '2021-02-17 18:21:37', '2021-02-17 18:21:37'),
(434, 469, 'hpback.JPG', '2021-02-17 18:21:37', '2021-02-17 18:21:37'),
(435, 472, 'Toilet-Construction-Quote_1.pdf', '2021-02-19 14:12:19', '2021-02-19 14:12:19'),
(436, 473, 'Quotation-General Expenses_1.pdf', '2021-02-20 08:11:52', '2021-02-20 08:11:52'),
(437, 474, 'BETTER GLOBE FORESTRY.pdf', '2021-02-20 08:29:50', '2021-02-20 08:29:50'),
(438, 475, 'PruningSaw-QUOTE.pdf', '2021-02-22 07:47:32', '2021-02-22 07:47:32'),
(439, 477, 'Generator-Quote.pdf', '2021-02-22 14:57:52', '2021-02-22 14:57:52'),
(440, 478, 'Generator-Quote.pdf', '2021-02-22 15:01:35', '2021-02-22 15:01:35'),
(441, 480, 'BatteriesQuote02-23-2021 11.18_1.pdf', '2021-02-23 09:29:36', '2021-02-23 09:29:36'),
(442, 481, '4T&2TOil02-23-2021 10.59_1.pdf', '2021-02-23 09:42:57', '2021-02-23 09:42:57'),
(443, 482, 'Omo&MilkQuote02-23-2021 11.16_1.pdf', '2021-02-23 09:55:31', '2021-02-23 09:55:31'),
(444, 484, 'Generator-Quote.pdf', '2021-02-23 15:56:41', '2021-02-23 15:56:41'),
(445, 486, 'WIWA-Quote&JobCard.pdf', '2021-02-24 06:43:49', '2021-02-24 06:43:49'),
(446, 487, 'Power-Saw-Repairs_1.pdf', '2021-02-24 09:27:22', '2021-02-24 09:27:22'),
(447, 489, 'Mower_Quotation_Alibhai.pdf', '2021-02-25 10:22:03', '2021-02-25 10:22:03'),
(448, 491, 'Quotation-11811-Better Globe Forestry.pdf', '2021-02-26 04:36:01', '2021-02-26 04:36:01'),
(449, 479, 'Davis & Shirtliff Quotation.pdf', '2021-02-26 04:44:45', '2021-02-26 04:44:45'),
(450, 492, 'Q-04222 - Better Globe Forestry Ltd. - 25_02_2021 (1).pdf', '2021-02-26 04:49:47', '2021-02-26 04:49:47'),
(451, 465, 'Samung Quotation.pdf', '2021-02-26 07:33:19', '2021-02-26 07:33:19'),
(452, 493, 'Down Stairs_Printer Job Card.pdf', '2021-02-26 08:35:54', '2021-02-26 08:35:54'),
(453, 465, 'Samung Quotation.pdf', '2021-02-26 09:40:41', '2021-02-26 09:40:41'),
(454, 494, 'KIAMBERE TABLET REPAIR.pdf', '2021-02-26 12:46:43', '2021-02-26 12:46:43'),
(455, 480, 'StockRequisitionForms 02-27-2021.pdf', '2021-02-27 06:46:23', '2021-02-27 06:46:23'),
(456, 482, 'StockRequisitionForms 02-27-2021.pdf', '2021-02-27 06:52:43', '2021-02-27 06:52:43'),
(457, 481, '4T&2T 02-27-2021.pdf', '2021-02-27 08:24:58', '2021-02-27 08:24:58'),
(458, 492, 'StokeForm02-27-2021.pdf', '2021-02-27 08:30:31', '2021-02-27 08:30:31'),
(459, 488, 'CamScanner 02-27-2021 15.46.pdf', '2021-02-27 14:20:54', '2021-02-27 14:20:54'),
(460, 495, 'Machines breakdown reporting 20201112.xlsx', '2021-02-28 07:05:50', '2021-02-28 07:05:50'),
(461, 496, 'Machines breakdown reporting 20201112.xlsx', '2021-02-28 07:28:44', '2021-02-28 07:28:44'),
(462, 497, 'Solar upgrade.pdf', '2021-03-01 09:32:07', '2021-03-01 09:32:07'),
(463, 493, 'better globe quote for drum kit for kyocera m2035dn 2018.doc', '2021-03-01 13:14:56', '2021-03-01 13:14:56'),
(464, 498, 'BETTER GLOBE MF268 & 275XTRA.pdf', '2021-03-01 15:20:15', '2021-03-01 15:20:15'),
(465, 502, 'PPE store poles quote.pdf', '2021-03-03 12:46:15', '2021-03-03 12:46:15'),
(466, 503, 'PPe store materials1 quote.pdf', '2021-03-03 12:59:04', '2021-03-03 12:59:04'),
(467, 505, 'New Document(6) (1).pdf', '2021-03-04 09:27:50', '2021-03-04 09:27:50'),
(468, 506, 'Document (4).pdf', '2021-03-04 12:23:17', '2021-03-04 12:23:17'),
(469, 506, 'Document (3).pdf', '2021-03-04 12:23:17', '2021-03-04 12:23:17'),
(470, 492, 'engine oil(1).pdf', '2021-03-05 06:58:20', '2021-03-05 06:58:20'),
(471, 517, 'Tyre-Quotation.pdf', '2021-03-09 07:39:33', '2021-03-09 07:39:33'),
(473, 519, 'Tyre-Quotation.pdf', '2021-03-09 08:16:47', '2021-03-09 08:16:47'),
(474, 521, 'IMG-20210308-Mas.jpg', '2021-03-09 10:50:26', '2021-03-09 10:50:26'),
(475, 515, 'PPE structure poles.xlsx', '2021-03-09 15:27:22', '2021-03-09 15:27:22'),
(476, 518, 'PPE structure materials.xlsx', '2021-03-09 15:32:00', '2021-03-09 15:32:00'),
(477, 526, 'FIRST AID KIT QUOTATION.pdf', '2021-03-10 04:01:00', '2021-03-10 04:01:00'),
(478, 526, 'FIRST AID KIT QUOTATION.pdf', '2021-03-10 04:59:20', '2021-03-10 04:59:20'),
(479, 513, '20210307-083038_p3.jpg', '2021-03-10 05:04:33', '2021-03-10 05:04:33'),
(480, 509, '20210307-101055_p4.jpg', '2021-03-10 05:05:47', '2021-03-10 05:05:47'),
(481, 509, '20210307-101055_p0.jpg', '2021-03-10 05:05:47', '2021-03-10 05:05:47'),
(482, 509, '20210307-101055_p1.jpg', '2021-03-10 05:05:49', '2021-03-10 05:05:49'),
(483, 509, '20210307-101055_p2.jpg', '2021-03-10 05:05:49', '2021-03-10 05:05:49'),
(484, 509, '20210307-101055_p3.jpg', '2021-03-10 05:05:51', '2021-03-10 05:05:51'),
(485, 510, '20210307-101055_p0.jpg', '2021-03-10 05:08:02', '2021-03-10 05:08:02'),
(486, 510, '20210307-101055_p1.jpg', '2021-03-10 05:08:02', '2021-03-10 05:08:02'),
(487, 510, '20210307-101055_p2.jpg', '2021-03-10 05:08:04', '2021-03-10 05:08:04'),
(488, 510, '20210307-101055_p3.jpg', '2021-03-10 05:08:04', '2021-03-10 05:08:04'),
(489, 510, '20210307-101055_p4.jpg', '2021-03-10 05:08:06', '2021-03-10 05:08:06'),
(490, 511, '20210307-083038_p8.jpg', '2021-03-10 05:12:25', '2021-03-10 05:12:25'),
(491, 511, '20210307-083038_p9.jpg', '2021-03-10 05:12:25', '2021-03-10 05:12:25'),
(492, 511, '20210307-083038_p1.jpg', '2021-03-10 05:12:27', '2021-03-10 05:12:27'),
(493, 511, '20210307-083038_p2.jpg', '2021-03-10 05:12:27', '2021-03-10 05:12:27'),
(494, 511, '20210307-083038_p4.jpg', '2021-03-10 05:12:29', '2021-03-10 05:12:29'),
(495, 511, '20210307-083038_p5.jpg', '2021-03-10 05:12:29', '2021-03-10 05:12:29'),
(496, 511, '20210307-083038_p6.jpg', '2021-03-10 05:12:31', '2021-03-10 05:12:31'),
(497, 511, '20210307-083038_p7.jpg', '2021-03-10 05:12:31', '2021-03-10 05:12:31'),
(498, 527, 'FUEL 20210310.pdf', '2021-03-10 07:58:18', '2021-03-10 07:58:18'),
(499, 529, 'CamScanner 03-10-2021 11.44_1.pdf', '2021-03-10 09:20:04', '2021-03-10 09:20:04'),
(500, 530, 'New security uniform..odt', '2021-03-10 09:37:25', '2021-03-10 09:37:25'),
(501, 532, 'Proforma Invoice BetterGlobe.pdf', '2021-03-11 12:38:12', '2021-03-11 12:38:12'),
(502, 533, 'SAMSUNG TABLET SM-P585 CHARGER.jpg', '2021-03-11 12:44:22', '2021-03-11 12:44:22'),
(503, 534, 'KAL QUOTATION BETTER GLOBE - KMFB 001T -10-03-21.pdf', '2021-03-14 06:51:04', '2021-03-14 06:51:04'),
(504, 535, '20210314-102103_p0[1].jpg', '2021-03-14 07:25:33', '2021-03-14 07:25:33'),
(505, 536, '20210314-190446_p0[1].jpg', '2021-03-14 16:20:51', '2021-03-14 16:20:51'),
(506, 538, 'Battery Perfomance _Philemon.odt', '2021-03-15 12:20:03', '2021-03-15 12:20:03'),
(507, 533, 'Quote tec ..pdf', '2021-03-15 13:50:19', '2021-03-15 13:50:19'),
(508, 540, 'QUOTATION(2).pdf', '2021-03-15 18:49:08', '2021-03-15 18:49:08'),
(509, 526, 'IMG-20210315-WA0017.jpg', '2021-03-16 05:53:34', '2021-03-16 05:53:34'),
(510, 526, 'kit items.docx', '2021-03-16 05:53:34', '2021-03-16 05:53:34'),
(511, 538, 'Quote battery 467.pdf', '2021-03-16 07:35:52', '2021-03-16 07:35:52'),
(512, 541, 'Posta intro letter.pdf', '2021-03-16 13:44:25', '2021-03-16 13:44:25'),
(513, 542, 'Latrine painting Quote.pdf', '2021-03-17 15:01:04', '2021-03-17 15:01:04'),
(514, 543, 'PPE Quote.pdf', '2021-03-17 15:19:23', '2021-03-17 15:19:23'),
(515, 549, 'Petrol Req..pdf', '2021-03-18 08:35:51', '2021-03-18 08:35:51'),
(516, 551, 'Petrol Quote03-18-2021 11.50.pdf', '2021-03-18 08:59:47', '2021-03-18 08:59:47'),
(517, 552, 'Oscom 20210318.pdf', '2021-03-18 09:46:09', '2021-03-18 09:46:09'),
(518, 555, 'CamScanner 03-18-2021 14.40.pdf', '2021-03-18 11:45:13', '2021-03-18 11:45:13'),
(519, 554, 'Printer Job Card March 2021.pdf', '2021-03-18 13:15:39', '2021-03-18 13:15:39'),
(520, 557, 'JayKay_Quote.pdf', '2021-03-18 16:22:10', '2021-03-18 16:22:10'),
(521, 557, 'LPO-SHAFT-JARIBUNI.pdf', '2021-03-18 16:33:27', '2021-03-18 16:33:27'),
(522, 565, 'BETTER GLOBE TRACTOR CANOPY.pdf', '2021-03-20 07:42:04', '2021-03-20 07:42:04'),
(523, 566, 'Sales Quote PF-KLA506506-2.pdf', '2021-03-22 08:08:57', '2021-03-22 08:08:57'),
(524, 567, 'Sales Quote PF-KLA506506-2.pdf', '2021-03-22 13:38:32', '2021-03-22 13:38:32'),
(525, 576, 'Q-07060 - Better Globe Forestry Ltd. - 23_03_2021.pdf', '2021-03-23 17:46:30', '2021-03-23 17:46:30'),
(526, 576, 'D6M-WornOut_Sprocket_DEMO.pdf', '2021-03-23 17:48:43', '2021-03-23 17:48:43'),
(527, 580, 'mouse.pdf', '2021-03-24 10:37:59', '2021-03-24 10:37:59'),
(528, 581, 'Tiles-Quote.pdf', '2021-03-24 17:39:12', '2021-03-24 17:39:12'),
(529, 582, 'CamScanner 03-22-2021 15.28.pdf', '2021-03-24 18:09:59', '2021-03-24 18:09:59'),
(530, 548, 'Pruning saw 20210325 Quotation.pdf', '2021-03-25 11:04:00', '2021-03-25 11:04:00'),
(531, 548, 'IMG_20200220_100544_412.jpg', '2021-03-25 11:04:00', '2021-03-25 11:04:00'),
(532, 546, 'Stationary pics.jpg', '2021-03-25 11:14:38', '2021-03-25 11:14:38'),
(533, 546, 'Oscom 20210325 Quote.pdf', '2021-03-25 11:14:38', '2021-03-25 11:14:38'),
(534, 583, 'BETTER GLOBE STABILIZER WHEELamended.pdf', '2021-03-25 16:25:18', '2021-03-25 16:25:18'),
(535, 583, 'DepthWheel_Sample.pdf', '2021-03-25 16:26:02', '2021-03-25 16:26:02'),
(536, 547, 'Office material Quote 20210326.pdf', '2021-03-26 07:14:42', '2021-03-26 07:14:42'),
(537, 550, 'White board pic.jpg', '2021-03-26 07:19:00', '2021-03-26 07:19:00'),
(538, 550, 'White board quote 20210326.pdf', '2021-03-26 07:19:00', '2021-03-26 07:19:00'),
(539, 585, 'Tiles-Quote.pdf', '2021-03-26 09:43:37', '2021-03-26 09:43:37'),
(540, 586, 'M2 SSD 256GB.jpg', '2021-03-26 13:58:54', '2021-03-26 13:58:54'),
(541, 589, 'IMG-20210308-WA0003.jpg', '2021-03-28 08:45:18', '2021-03-28 08:45:18'),
(542, 589, 'IMG-20210327-WA0023.jpg', '2021-03-28 08:45:18', '2021-03-28 08:45:18'),
(543, 534, 'Machines breakdown reporting 20201112.xlsx', '2021-03-28 09:14:49', '2021-03-28 09:14:49'),
(544, 591, '20210329-091812_p0[1].jpg', '2021-03-29 06:19:42', '2021-03-29 06:19:42'),
(545, 537, '20210329-134528_p0[1].jpg', '2021-03-29 10:55:33', '2021-03-29 10:55:33'),
(546, 592, 'QUOTATION #6478.pdf', '2021-03-29 13:33:36', '2021-03-29 13:33:36'),
(547, 592, 'QUOTATION #6478.pdf', '2021-03-29 13:42:00', '2021-03-29 13:42:00'),
(548, 593, 'Fuel 20210329.pdf', '2021-03-29 14:08:22', '2021-03-29 14:08:22'),
(549, 594, 'Machines breakdown reporting 20201112.xlsx', '2021-03-29 18:54:47', '2021-03-29 18:54:47'),
(550, 595, 'Machines breakdown reporting 20201112.xlsx', '2021-03-29 20:36:12', '2021-03-29 20:36:12'),
(551, 596, 'Machines breakdown reporting 20201112.xlsx', '2021-03-29 20:52:41', '2021-03-29 20:52:41'),
(552, 597, 'Machines breakdown reporting 20201112.xlsx', '2021-03-30 03:38:17', '2021-03-30 03:38:17'),
(553, 589, '20210330-095737_p0[1].jpg', '2021-03-30 07:31:34', '2021-03-30 07:31:34'),
(554, 599, '20210323-113920_p0[1].jpg', '2021-03-30 07:54:05', '2021-03-30 07:54:05'),
(555, 600, '20210323-113920_p0[1].jpg', '2021-03-30 08:00:15', '2021-03-30 08:00:15'),
(556, 602, 'Wheel Studs_Quotation.pdf', '2021-03-30 10:38:57', '2021-03-30 10:38:57'),
(557, 603, '20210314-190446_p0[1].jpg', '2021-03-30 10:59:47', '2021-03-30 10:59:47'),
(558, 606, 'mouse.pdf', '2021-03-30 12:12:18', '2021-03-30 12:12:18'),
(559, 607, 'Budget wheel covers.PNG', '2021-03-30 12:12:34', '2021-03-30 12:12:34'),
(560, 607, 'QUO454115 Wheel Covers Quotation for 20.pdf', '2021-03-30 12:12:34', '2021-03-30 12:12:34'),
(561, 608, '20210330-152422_p0[1].jpg', '2021-03-30 12:40:54', '2021-03-30 12:40:54'),
(562, 608, '20210330-095737_p0[1].jpg', '2021-03-30 12:44:37', '2021-03-30 12:44:37'),
(563, 582, 'QUOTATION_SIGNBOARDS.pdf', '2021-03-31 04:43:10', '2021-03-31 04:43:10'),
(564, 611, 'QUOTATION PPE-STORE.pdf', '2021-03-31 06:37:37', '2021-03-31 06:37:37'),
(565, 612, '20210330-152422_p0[1].jpg', '2021-03-31 07:29:05', '2021-03-31 07:29:05'),
(566, 588, 'Quotation-Toilex.pdf', '2021-03-31 08:01:09', '2021-03-31 08:01:09'),
(567, 614, 'Quotation-5693-Better Globe Forestry.pdf', '2021-03-31 08:40:57', '2021-03-31 08:40:57'),
(568, 568, 'SALES QUOTE1. BETTER GLOBE.pdf', '2021-03-31 09:42:31', '2021-03-31 09:42:31'),
(569, 615, 'SALES QUOTE2.BETTER GLOBE.pdf', '2021-03-31 10:30:19', '2021-03-31 10:30:19'),
(570, 617, 'Budget.PNG', '2021-03-31 14:02:28', '2021-03-31 14:02:28'),
(571, 620, '20210401-101922_p0[1].jpg', '2021-04-01 07:40:01', '2021-04-01 07:40:01'),
(572, 448, 'K8 document Quotation-01228801.pdf', '2021-04-01 09:22:32', '2021-04-01 09:22:32'),
(573, 448, 'K8 document Quotation-01228801.pdf', '2021-04-01 11:32:32', '2021-04-01 11:32:32'),
(574, 622, 'Muskir Stationers quotation.pdf', '2021-04-06 06:33:34', '2021-04-06 06:33:34'),
(575, 610, 'Technology Today Quote.pdf', '2021-04-06 11:49:29', '2021-04-06 11:49:29'),
(576, 625, 'OLD CRUX-KMDQ 509D.pdf', '2021-04-06 12:04:00', '2021-04-06 12:04:00'),
(577, 542, 'Latrine painting Quote.pdf', '2021-04-06 12:27:52', '2021-04-06 12:27:52'),
(578, 628, 'CRUX REV-KMET 470K.pdf', '2021-04-06 14:56:35', '2021-04-06 14:56:35'),
(579, 622, 'Muskir Stationers quotation.pdf', '2021-04-07 05:16:22', '2021-04-07 05:16:22'),
(580, 586, 'M.2SSD quote.pdf', '2021-04-07 09:38:07', '2021-04-07 09:38:07'),
(581, 555, 'Transcom Supplies Quote.pdf', '2021-04-07 09:38:47', '2021-04-07 09:38:47'),
(582, 630, 'MTN EMAIL correspondence With BGF.docx', '2021-04-07 11:44:33', '2021-04-07 11:44:33'),
(583, 624, 'TALKSHOW APR QUOTE.pdf', '2021-04-07 12:28:19', '2021-04-07 12:28:19'),
(584, 633, 'Materials Quote2.pdf', '2021-04-07 15:47:33', '2021-04-07 15:47:33'),
(585, 634, 'Cleaning Quote.pdf', '2021-04-07 16:01:27', '2021-04-07 16:01:27'),
(586, 622, 'Muskir Stationers quotation.pdf', '2021-04-08 05:38:56', '2021-04-08 05:38:56'),
(587, 610, 'Technology Today Quote.pdf', '2021-04-08 05:42:18', '2021-04-08 05:42:18'),
(588, 586, 'M.2SSD quote.pdf', '2021-04-08 05:47:24', '2021-04-08 05:47:24'),
(589, 586, 'M.2SSD quote.pdf', '2021-04-08 05:59:01', '2021-04-08 05:59:01'),
(590, 579, 'Jemtric Quotation.pdf', '2021-04-08 05:59:57', '2021-04-08 05:59:57'),
(591, 555, 'Transcom Supplies Quote.pdf', '2021-04-08 06:06:50', '2021-04-08 06:06:50'),
(592, 607, 'QUO454115 Wheel Covers Quotation for 20.pdf', '2021-04-08 06:16:07', '2021-04-08 06:16:07'),
(593, 542, 'Latrine painting Quote.pdf', '2021-04-08 06:16:44', '2021-04-08 06:16:44'),
(594, 637, 'Training Budget, Adobe.PNG', '2021-04-09 09:27:06', '2021-04-09 09:27:06'),
(595, 637, 'TRAINING QUOTE2-Dan.pdf', '2021-04-09 09:27:06', '2021-04-09 09:27:06'),
(596, 638, 'SAMSUNG TABLET SM-P585 CHARGER.jpg', '2021-04-09 16:07:19', '2021-04-09 16:07:19'),
(597, 639, '7 Forks Overal sizes,gumboots and raincoat.xls', '2021-04-12 02:26:09', '2021-04-12 02:26:09'),
(598, 640, '7 Forks Overal sizes,gumboots and raincoat.xls', '2021-04-12 02:29:25', '2021-04-12 02:29:25'),
(599, 640, 'BETTER GLOBE FORESTRY    .Quote gumboots pdf A.pdf', '2021-04-12 02:32:55', '2021-04-12 02:32:55'),
(600, 639, 'BETTER GLOBE FORESTRY    .Quote gumboots pdf A.pdf', '2021-04-12 02:34:39', '2021-04-12 02:34:39'),
(601, 642, 'KENYA RED CROSS SOCIET5.docx', '2021-04-12 03:54:54', '2021-04-12 03:54:54'),
(602, 638, 'Quote tec charger.pdf', '2021-04-12 06:36:25', '2021-04-12 06:36:25'),
(603, 644, 'Power Saw-QUOTE.pdf', '2021-04-12 06:46:15', '2021-04-12 06:46:15'),
(604, 645, 'Watering System-Quote.pdf', '2021-04-12 07:41:32', '2021-04-12 07:41:32'),
(605, 610, 'Technology .pdf', '2021-04-12 08:18:43', '2021-04-12 08:18:43'),
(606, 647, 'WhatsApp Image 2021-04-08 at 14.31.06.jpeg', '2021-04-12 09:05:39', '2021-04-12 09:05:39'),
(607, 616, 'MSLKE-QUO-2021-000414.pdf', '2021-04-12 09:48:42', '2021-04-12 09:48:42'),
(608, 610, 'Technlogy Laptop Core I3.pdf', '2021-04-12 09:52:01', '2021-04-12 09:52:01'),
(609, 644, 'Powersaw_Repairs.xlsx', '2021-04-12 11:15:24', '2021-04-12 11:15:24'),
(610, 542, 'Latrine painting Quote.pdf', '2021-04-12 11:18:13', '2021-04-12 11:18:13'),
(611, 610, 'Sai Quote HP.docx', '2021-04-12 11:19:04', '2021-04-12 11:19:04'),
(612, 625, 'Machines Breakdown_KMDQ509D.xlsx', '2021-04-12 11:20:47', '2021-04-12 11:20:47'),
(613, 631, 'MOTHERBOARD QUOTE.pdf', '2021-04-12 11:42:51', '2021-04-12 11:42:51'),
(614, 631, 'MOTHERBOARD QUOTE.pdf', '2021-04-12 11:42:52', '2021-04-12 11:42:52'),
(615, 448, 'Prunning-Quotation-12328.pdf', '2021-04-12 11:48:02', '2021-04-12 11:48:02'),
(616, 448, 'Prunning-Quotation-12328.pdf', '2021-04-12 11:48:33', '2021-04-12 11:48:33'),
(617, 628, 'Machines Breakdown_KMET470K.xlsx', '2021-04-12 12:06:40', '2021-04-12 12:06:40'),
(618, 650, 'Tank base Quote 20210413.pdf', '2021-04-13 04:57:48', '2021-04-13 04:57:48'),
(619, 651, 'FUEL INVOICE 20210413.pdf', '2021-04-13 06:03:18', '2021-04-13 06:03:18'),
(620, 651, 'New Document(2) 13-Apr-2021 08-24-37.pdf', '2021-04-13 06:05:57', '2021-04-13 06:05:57'),
(621, 648, 'CamScanner 04-13-2021 12.55.pdf', '2021-04-13 09:59:36', '2021-04-13 09:59:36'),
(622, 649, 'CamScanner 04-13-2021 13.50.pdf', '2021-04-13 11:05:24', '2021-04-13 11:05:24'),
(623, 627, 'phonecom.pdf', '2021-04-13 11:45:57', '2021-04-13 11:45:57'),
(624, 637, 'TRAINING QUOTE2-Dan.pdf', '2021-04-13 12:19:22', '2021-04-13 12:19:22'),
(625, 658, 'IMG-20210414-WA0023[1].jpg', '2021-04-14 07:57:03', '2021-04-14 07:57:03'),
(626, 659, 'CamScanner 04-14-2021 11.23.pdf', '2021-04-14 08:31:50', '2021-04-14 08:31:50'),
(627, 662, 'Motorbike repairs quote 20210414.pdf', '2021-04-14 11:42:15', '2021-04-14 11:42:15'),
(628, 662, 'MOTORBIKES BREAKDOWN AS AT 20210414 DKL.xlsx', '2021-04-14 11:45:54', '2021-04-14 11:45:54'),
(629, 664, 'phonecom.pdf', '2021-04-15 05:32:45', '2021-04-15 05:32:45'),
(630, 665, 'Statement As at 15th April 2021.pdf', '2021-04-15 07:02:07', '2021-04-15 07:02:07'),
(631, 665, 'Stament as at 15th April 2021 4.pdf', '2021-04-15 07:30:39', '2021-04-15 07:30:39'),
(632, 662, 'MOTORBIKES BREAKDOWN AS AT 20210414 DKL.xlsx', '2021-04-15 15:25:10', '2021-04-15 15:25:10'),
(633, 668, 'Stephen Laptop Battery Status.png', '2021-04-15 17:51:47', '2021-04-15 17:51:47'),
(634, 669, 'CamScanner 04-16-2021 10.22.pdf', '2021-04-16 07:26:13', '2021-04-16 07:26:13'),
(635, 639, 'Transcom Supplies Quote.pdf', '2021-04-16 07:54:51', '2021-04-16 07:54:51'),
(636, 640, 'Transcom Supplies Quote.pdf', '2021-04-16 07:55:32', '2021-04-16 07:55:32'),
(637, 634, 'Stock requisition form Cleaning 20210416.xlsx', '2021-04-16 08:26:42', '2021-04-16 08:26:42'),
(638, 670, 'Quotation.pdf', '2021-04-18 13:11:53', '2021-04-18 13:11:53'),
(639, 670, 'Job Card.pdf', '2021-04-18 13:28:33', '2021-04-18 13:28:33'),
(640, 671, 'JobCard&Quote-Fire Extinguishers.pdf', '2021-04-18 14:20:04', '2021-04-18 14:20:04'),
(641, 565, 'Canopy Photo.pdf', '2021-04-18 14:37:13', '2021-04-18 14:37:13'),
(642, 667, 'Tec Quote 34.jpg', '2021-04-19 09:00:06', '2021-04-19 09:00:06'),
(643, 644, 'Copy of PowerSaw-Repairs.xlsx', '2021-04-19 13:16:28', '2021-04-19 13:16:28'),
(644, 674, '7 Forks site staff in need of tablets.xls', '2021-04-19 14:26:37', '2021-04-19 14:26:37'),
(645, 675, 'CamScanner 04-19-2021 17.01_1.pdf', '2021-04-19 14:34:59', '2021-04-19 14:34:59'),
(646, 676, 'QUOTATION.pdf', '2021-04-19 16:26:49', '2021-04-19 16:26:49'),
(647, 652, 'Memory Cards-Photo.pdf', '2021-04-20 05:50:56', '2021-04-20 05:50:56'),
(648, 677, 'April radio talk show content 200412.docx', '2021-04-20 05:53:35', '2021-04-20 05:53:35'),
(649, 678, 'BETTER GLOBE.QUOTE.pdf', '2021-04-20 06:17:16', '2021-04-20 06:17:16'),
(650, 654, '20210420-185537_p0.jpg', '2021-04-20 19:58:52', '2021-04-20 19:58:52'),
(651, 654, '20210420-185537_p1.jpg', '2021-04-20 19:58:52', '2021-04-20 19:58:52'),
(652, 654, '20210420-185537_p2.jpg', '2021-04-20 19:58:52', '2021-04-20 19:58:52'),
(653, 654, '20210420-185537_p3.jpg', '2021-04-20 19:58:52', '2021-04-20 19:58:52'),
(654, 654, '20210420-185537_p4.jpg', '2021-04-20 19:58:54', '2021-04-20 19:58:54'),
(655, 654, '20210420-185537_p5.jpg', '2021-04-20 19:58:54', '2021-04-20 19:58:54'),
(656, 654, '20210420-185537_p6.jpg', '2021-04-20 19:58:54', '2021-04-20 19:58:54'),
(657, 657, '20210420-185537_p0.jpg', '2021-04-20 20:00:28', '2021-04-20 20:00:28'),
(658, 657, '20210420-185537_p1.jpg', '2021-04-20 20:00:28', '2021-04-20 20:00:28'),
(659, 657, '20210420-185537_p2.jpg', '2021-04-20 20:00:30', '2021-04-20 20:00:30'),
(660, 657, '20210420-185537_p3.jpg', '2021-04-20 20:00:30', '2021-04-20 20:00:30'),
(661, 657, '20210420-185537_p4.jpg', '2021-04-20 20:00:30', '2021-04-20 20:00:30'),
(662, 657, '20210420-185537_p5.jpg', '2021-04-20 20:00:32', '2021-04-20 20:00:32'),
(663, 657, '20210420-185537_p6.jpg', '2021-04-20 20:00:32', '2021-04-20 20:00:32'),
(664, 655, '20210419-110310_p0.jpg', '2021-04-20 20:03:45', '2021-04-20 20:03:45'),
(665, 655, '20210419-110310_p1.jpg', '2021-04-20 20:03:45', '2021-04-20 20:03:45'),
(666, 655, '20210419-110310_p2.jpg', '2021-04-20 20:03:45', '2021-04-20 20:03:45'),
(667, 655, '20210419-110310_p3.jpg', '2021-04-20 20:03:45', '2021-04-20 20:03:45'),
(668, 656, '20210419-110310_p0.jpg', '2021-04-20 20:06:23', '2021-04-20 20:06:23'),
(669, 656, '20210419-110310_p1.jpg', '2021-04-20 20:06:24', '2021-04-20 20:06:24'),
(670, 656, '20210419-110310_p2.jpg', '2021-04-20 20:06:24', '2021-04-20 20:06:24'),
(671, 656, '20210419-110310_p3.jpg', '2021-04-20 20:06:26', '2021-04-20 20:06:26'),
(672, 680, '20210323-113920_p0[1].jpg', '2021-04-20 20:28:05', '2021-04-20 20:28:05'),
(673, 681, '20210323-113920_p0[1].jpg', '2021-04-20 20:33:25', '2021-04-20 20:33:25'),
(674, 686, 'WESTA CAR CUSHIONS- QUOTATION.docx', '2021-04-21 11:00:09', '2021-04-21 11:00:09'),
(675, 690, 'document.pdf', '2021-04-21 16:10:39', '2021-04-21 16:10:39'),
(676, 691, 'eagles grafix quotation - Laptops.pdf', '2021-04-22 05:05:53', '2021-04-22 05:05:53'),
(677, 691, 'HP Laptop Quotation.docx', '2021-04-22 05:05:53', '2021-04-22 05:05:53'),
(678, 691, 'Sai office Better Globe 303889 - Laptops.pdf', '2021-04-22 05:05:53', '2021-04-22 05:05:53'),
(679, 691, 'Sai Office Better Globe-Laptops.pdf', '2021-04-22 05:05:53', '2021-04-22 05:05:53'),
(680, 691, 'Technology Today Quote - Laptops.pdf', '2021-04-22 05:05:53', '2021-04-22 05:05:53'),
(681, 592, 'FGEE Technology -Mini Server.doc', '2021-04-22 05:12:04', '2021-04-22 05:12:04'),
(682, 692, 'delights africa Quotation.pdf', '2021-04-22 05:41:33', '2021-04-22 05:41:33'),
(683, 692, 'eagles grafix quotation - Laptops.pdf', '2021-04-22 05:41:33', '2021-04-22 05:41:33'),
(684, 592, 'delights africa Quotation.pdf', '2021-04-22 05:48:13', '2021-04-22 05:48:13'),
(685, 693, 'List of Operators&Drivers.xlsx', '2021-04-22 06:02:47', '2021-04-22 06:02:47'),
(686, 696, 'document(1).pdf', '2021-04-22 15:59:31', '2021-04-22 15:59:31'),
(687, 697, 'PPE STORE FLOOR QUOTE.pdf', '2021-04-22 23:51:31', '2021-04-22 23:51:31'),
(688, 698, 'PPE STORE FLOOR COSTING.xlsx', '2021-04-23 08:47:16', '2021-04-23 08:47:16'),
(689, 698, 'PPE STORE FLOOR QUOTE.pdf', '2021-04-23 08:47:16', '2021-04-23 08:47:16'),
(690, 699, '#WPQUO-00026.pdf', '2021-04-23 09:33:16', '2021-04-23 09:33:16'),
(691, 674, 'Tablet Quote.pdf', '2021-04-23 10:14:48', '2021-04-23 10:14:48'),
(692, 674, 'Est_634_from_CAPTURE_SOLUTIONS_LTD_2400.pdf', '2021-04-23 10:51:43', '2021-04-23 10:51:43'),
(693, 668, 'BetterGlobeForestry2304RWR01.pdf', '2021-04-23 12:15:06', '2021-04-23 12:15:06'),
(694, 700, 'NY-STAFF-Gumboots.xlsx', '2021-04-23 13:24:11', '2021-04-23 13:24:11'),
(695, 701, 'NY-STAFF-Gumboots.xlsx', '2021-04-23 13:28:20', '2021-04-23 13:28:20'),
(696, 701, 'Quotation-5805-Better Globe Forestry.pdf', '2021-04-23 13:30:53', '2021-04-23 13:30:53'),
(697, 702, 'Painting qoute 20210424.pdf', '2021-04-24 17:41:21', '2021-04-24 17:41:21'),
(698, 680, 'STOCK FORM REPORT KIA 7F-April.xlsx', '2021-04-25 19:02:38', '2021-04-25 19:02:38'),
(699, 703, 'Copy of Electric-Fence-Costing_Draft7_260421.xlsx', '2021-04-26 05:12:43', '2021-04-26 05:12:43'),
(700, 705, 'Calliper DP.pdf', '2021-04-26 06:45:11', '2021-04-26 06:45:11'),
(701, 694, 'document(2).pdf', '2021-04-26 08:18:34', '2021-04-26 08:18:34'),
(702, 681, 'STOCK FORM REPORT KIA 7F-April.xlsx', '2021-04-26 09:37:43', '2021-04-26 09:37:43'),
(703, 648, 'Stock Requisition Form260421.pdf', '2021-04-26 10:13:02', '2021-04-26 10:13:02'),
(704, 649, 'Stock Requisition Form260421.pdf', '2021-04-26 10:15:21', '2021-04-26 10:15:21'),
(705, 708, 'BalancesOnCards (6).PDF', '2021-04-26 10:33:19', '2021-04-26 10:33:19'),
(706, 701, 'Transcom Supplies Quote.pdf', '2021-04-26 13:07:28', '2021-04-26 13:07:28'),
(707, 693, 'Quotation for overalls  and raincoat.pdf', '2021-04-26 13:08:20', '2021-04-26 13:08:20'),
(708, 709, 'Fuel 20210426.pdf', '2021-04-26 14:37:32', '2021-04-26 14:37:32'),
(709, 711, 'Poles Quotation.pdf', '2021-04-26 15:56:28', '2021-04-26 15:56:28'),
(710, 712, 'QUOTATION_FOR_PRUNING_SAW_AND_PRUNING_SHEAR_21-Apr-2021_10-20-37(2)[1].pdf', '2021-04-27 06:09:36', '2021-04-27 06:09:36'),
(711, 683, 'Photo frame quotation.docx', '2021-04-27 06:43:19', '2021-04-27 06:43:19'),
(712, 715, 'CamScanner 04-27-2021 10.27.pdf', '2021-04-27 07:32:45', '2021-04-27 07:32:45'),
(713, 653, 'ASUS REPAIR.pdf', '2021-04-27 13:13:04', '2021-04-27 13:13:04'),
(714, 716, 'Brush Cutter_QUOTE270421.pdf', '2021-04-27 16:41:45', '2021-04-27 16:41:45'),
(715, 559, 'Tablet cover Quote.pdf', '2021-04-28 06:29:19', '2021-04-28 06:29:19'),
(716, 718, 'AVS Quote.pdf', '2021-04-28 06:42:17', '2021-04-28 06:42:17'),
(717, 720, 'FIRST AID KIT CONTENTS REPLENISH.pdf', '2021-04-28 08:40:20', '2021-04-28 08:40:20'),
(718, 719, 'Photos.pdf', '2021-04-28 09:28:36', '2021-04-28 09:28:36'),
(719, 719, 'Electric-Fence-Costing_Draft6160421.xlsx', '2021-04-28 09:47:20', '2021-04-28 09:47:20'),
(720, 719, 'QUOTATION_FOR_ELECTRICFENCE150421.xls', '2021-04-28 09:47:20', '2021-04-28 09:47:20'),
(721, 721, 'Poles_Quote_KOMAZA.pdf', '2021-04-28 10:04:03', '2021-04-28 10:04:03'),
(722, 721, 'Electric-Fence-Costing_Draft6160421.xlsx', '2021-04-28 10:20:12', '2021-04-28 10:20:12'),
(723, 722, 'document(3).pdf', '2021-04-28 10:25:19', '2021-04-28 10:25:19'),
(724, 715, 'Petrol-Stock Level.pdf', '2021-04-28 11:56:08', '2021-04-28 11:56:08'),
(725, 721, 'Better Globe Forestry -Treated Poles&TransportCost.pdf', '2021-04-28 12:19:58', '2021-04-28 12:19:58'),
(726, 723, 'Printing budget.PNG', '2021-04-28 13:03:48', '2021-04-28 13:03:48'),
(727, 723, 'Ramco Quote.pdf', '2021-04-28 13:03:48', '2021-04-28 13:03:48'),
(728, 724, 'Design budget 2.PNG', '2021-04-28 13:06:58', '2021-04-28 13:06:58'),
(729, 724, 'Proforma Invoice.pdf', '2021-04-28 13:06:58', '2021-04-28 13:06:58'),
(730, 725, 'FIRST AID KIT CONTENTS REPLENISH.pdf', '2021-04-29 02:48:26', '2021-04-29 02:48:26'),
(731, 726, 'FIRST AID KIT CONTENTS REPLENISH.pdf', '2021-04-29 02:52:30', '2021-04-29 02:52:30'),
(732, 727, 'Office 365 Subscription renewal 2021.docx', '2021-04-29 07:18:28', '2021-04-29 07:18:28'),
(733, 728, 'Nails-Quote.pdf', '2021-04-29 12:44:49', '2021-04-29 12:44:49'),
(734, 729, 'CamScanner 04-29-2021 17.43.pdf', '2021-04-29 14:46:49', '2021-04-29 14:46:49'),
(735, 731, 'Quote.jpg', '2021-05-01 16:15:04', '2021-05-01 16:15:04'),
(736, 732, 'quote 1.jpg', '2021-05-01 19:36:36', '2021-05-01 19:36:36'),
(737, 733, 'CamScanner 04-30-2021 10.10.pdf', '2021-05-01 20:36:18', '2021-05-01 20:36:18'),
(738, 734, 'CamScanner 04-30-2021 10.10.pdf', '2021-05-01 20:41:31', '2021-05-01 20:41:31'),
(739, 735, 'CamScanner 04-29-2021 18.05(1).pdf', '2021-05-01 21:14:07', '2021-05-01 21:14:07'),
(740, 736, 'Puncture-Repair-Garage.pdf', '2021-05-02 15:09:54', '2021-05-02 15:09:54'),
(741, 735, 'SIGNPOSTS.pdf', '2021-05-03 14:49:26', '2021-05-03 14:49:26'),
(742, 674, 'Technology Today Discounted Price Quote.pdf', '2021-05-03 15:52:21', '2021-05-03 15:52:21'),
(743, 737, '20210430-145637[1].pdf', '2021-05-04 09:56:44', '2021-05-04 09:56:44'),
(744, 739, 'VIVO BALANCE.pdf', '2021-05-04 16:22:39', '2021-05-04 16:22:39'),
(745, 740, 'CamScanner 05-05-2021 02.14.pdf', '2021-05-05 02:26:48', '2021-05-05 02:26:48'),
(746, 741, 'IMG-20210430-WA0002.jpg', '2021-05-05 02:40:39', '2021-05-05 02:40:39'),
(747, 712, 'Groups to be issued with Pruning saws.xlsx', '2021-05-05 08:41:12', '2021-05-05 08:41:12'),
(748, 744, 'Printing budget.PNG', '2021-05-05 09:18:36', '2021-05-05 09:18:36'),
(749, 744, 'Ramco quote corrected.pdf', '2021-05-05 09:18:36', '2021-05-05 09:18:36'),
(750, 745, 'Poles_Quotation.pdf', '2021-05-05 15:49:20', '2021-05-05 15:49:20'),
(751, 745, 'Poles-Quotation050521.pdf', '2021-05-05 16:03:57', '2021-05-05 16:03:57'),
(752, 746, 'BETTER GLOBE QUOTATION_POWERSAW.pdf', '2021-05-05 20:16:57', '2021-05-05 20:16:57'),
(753, 747, 'IMG-20210430-WA0002.jpg', '2021-05-06 08:28:23', '2021-05-06 08:28:23'),
(754, 748, 'CamScanner 05-06-2021 08.57.pdf', '2021-05-06 09:04:03', '2021-05-06 09:04:03'),
(755, 748, 'Diesel Stock Balances.xlsx', '2021-05-06 10:01:41', '2021-05-06 10:01:41'),
(756, 749, 'document(4).pdf', '2021-05-06 15:44:51', '2021-05-06 15:44:51'),
(757, 750, 'printer quot.jpg', '2021-05-06 16:56:52', '2021-05-06 16:56:52'),
(758, 751, 'Riding PPEs Quote.pdf', '2021-05-06 17:33:56', '2021-05-06 17:33:56'),
(759, 752, 'OVERALLS QUOTE.jpg', '2021-05-06 17:59:01', '2021-05-06 17:59:01'),
(760, 753, 'Machines breakdown reporting 20201112.xlsx', '2021-05-07 06:50:52', '2021-05-07 06:50:52'),
(761, 674, 'Technology Today Discounted Price Quote.pdf', '2021-05-07 09:33:55', '2021-05-07 09:33:55'),
(762, 674, 'Technology Today Discounted Price Quote.pdf', '2021-05-07 10:04:59', '2021-05-07 10:04:59'),
(763, 754, 'Notice Board quote.pdf', '2021-05-07 13:58:11', '2021-05-07 13:58:11'),
(764, 755, 'CamScanner 04-17-2021 17.16.pdf', '2021-05-07 14:58:36', '2021-05-07 14:58:36'),
(765, 755, 'PROFORMA Water dispenser 20210204.pdf', '2021-05-07 14:58:36', '2021-05-07 14:58:36'),
(766, 758, 'QUOTATION(3).pdf', '2021-05-07 21:16:26', '2021-05-07 21:16:26'),
(767, 759, 'CamScanner 05-07-2021 09.04.pdf', '2021-05-07 21:29:50', '2021-05-07 21:29:50'),
(768, 760, 'CamScanner 05-07-2021 21.33.pdf', '2021-05-07 21:38:52', '2021-05-07 21:38:52'),
(769, 762, 'BETTER GLOBE 4.5.2021.pdf', '2021-05-08 21:48:20', '2021-05-08 21:48:20'),
(770, 763, 'Tyre-Repair-Quotation.pdf', '2021-05-08 22:06:06', '2021-05-08 22:06:06'),
(771, 764, 'CamScanner-Paints-Quote.pdf', '2021-05-09 13:41:08', '2021-05-09 13:41:08'),
(772, 749, 'H4&H5_Treated_Poles.pdf', '2021-05-10 11:47:32', '2021-05-10 11:47:32'),
(773, 714, 'GPSMAPS66i_Quote_070521.pdf', '2021-05-10 12:34:35', '2021-05-10 12:34:35'),
(774, 768, 'Better Globe Forestry-RPU 1500 Mower.pdf', '2021-05-10 14:22:55', '2021-05-10 14:22:55'),
(775, 730, 'quote8963.pdf', '2021-05-10 14:43:12', '2021-05-10 14:43:12'),
(776, 769, 'CamScanner.pdf', '2021-05-10 14:59:14', '2021-05-10 14:59:14'),
(777, 766, 'PPE STORE PAINTING QUOTE.pdf', '2021-05-10 18:15:19', '2021-05-10 18:15:19'),
(778, 770, 'AAs offices attendance records 20210417.pdf', '2021-05-10 18:31:06', '2021-05-10 18:31:06'),
(779, 770, 'PROFORMA Water dispenser 20210204.pdf', '2021-05-10 18:31:06', '2021-05-10 18:31:06'),
(780, 730, 'Sai Office Quote 564.pdf', '2021-05-11 08:52:05', '2021-05-11 08:52:05'),
(781, 716, 'Nairobi Safety Receipt.pdf', '2021-05-11 09:46:27', '2021-05-11 09:46:27'),
(782, 771, 'document(6).pdf', '2021-05-11 11:15:48', '2021-05-11 11:15:48'),
(783, 772, 'IMG-20210511-WA0002.jpg', '2021-05-11 13:59:59', '2021-05-11 13:59:59'),
(784, 773, 'WhatsApp Image 2021-05-11 at 4.20.50 PM.jpeg', '2021-05-11 16:56:15', '2021-05-11 16:56:15'),
(785, 773, 'WhatsApp Image 2021-05-11 at 8.18.30 AM (1).jpeg', '2021-05-11 16:56:15', '2021-05-11 16:56:15'),
(786, 773, 'WhatsApp Image 2021-05-11 at 8.18.30 AM.jpeg', '2021-05-11 16:56:15', '2021-05-11 16:56:15'),
(787, 712, 'Farmer Groups.ods', '2021-05-11 21:00:51', '2021-05-11 21:00:51'),
(788, 776, 'BalancesOnCards (9).PDF', '2021-05-13 09:33:45', '2021-05-13 09:33:45'),
(789, 777, 'BETTER GLOBE TRACTOR AUGER130521.pdf', '2021-05-13 10:24:18', '2021-05-13 10:24:18'),
(790, 714, 'Pompey Quote.pdf', '2021-05-13 15:31:46', '2021-05-13 15:31:46'),
(791, 781, 'BETTER GLOBE TROLLEY.pdf', '2021-05-13 19:15:48', '2021-05-13 19:15:48'),
(792, 782, 'better globe 12.06.2021.pdf', '2021-05-13 19:24:02', '2021-05-13 19:24:02'),
(793, 753, 'Quotation repairs- 11-May-2021 21-43-03.pdf', '2021-05-14 06:14:39', '2021-05-14 06:14:39'),
(794, 783, 'List of parts to source.docx', '2021-05-14 07:09:13', '2021-05-14 07:09:13'),
(795, 742, 'DEREK.jpg', '2021-05-14 08:18:48', '2021-05-14 08:18:48'),
(796, 784, 'CamScanner 05-14-2021 11.20.pdf', '2021-05-14 11:33:47', '2021-05-14 11:33:47'),
(797, 784, 'New Document 14-May-2021 09-42-45.pdf', '2021-05-14 11:35:57', '2021-05-14 11:35:57'),
(798, 786, 'D6M-REPAIRS.pdf', '2021-05-15 11:48:49', '2021-05-15 11:48:49'),
(799, 787, 'D6T_LGP.pdf', '2021-05-15 13:19:43', '2021-05-15 13:19:43'),
(800, 735, 'Nyongoro Plan on Marking Roads_Draft3.xlsx', '2021-05-15 22:21:20', '2021-05-15 22:21:20'),
(801, 793, 'TWO WAY RADIOS QUOTE.pdf', '2021-05-16 17:43:30', '2021-05-16 17:43:30'),
(802, 792, 'WhatsApp Image 2021-05-15 at 9.29.08 AM.jpeg', '2021-05-16 20:08:36', '2021-05-16 20:08:36'),
(803, 792, 'WhatsApp Image 2021-05-15 at 9.28.57 AM.jpeg', '2021-05-16 20:08:36', '2021-05-16 20:08:36'),
(804, 794, 'Brush_Cutter_Demo.pdf', '2021-05-16 22:15:17', '2021-05-16 22:15:17'),
(805, 795, 'Stickers.pdf', '2021-05-17 09:34:22', '2021-05-17 09:34:22'),
(806, 798, 'PPE gumboots 17-May-2021 11-37-57.pdf', '2021-05-17 11:52:18', '2021-05-17 11:52:18'),
(807, 799, 'Crates poles 17-May-2021 11-36-17.pdf', '2021-05-17 12:03:55', '2021-05-17 12:03:55'),
(808, 800, 'Crates store materials.pdf', '2021-05-17 12:24:04', '2021-05-17 12:24:04'),
(809, 801, 'Better Globe Forestry new quotation.pdf', '2021-05-17 14:00:22', '2021-05-17 14:00:22'),
(810, 802, 'Glorick investments Better Globe Forestry_2.pdf', '2021-05-17 14:38:10', '2021-05-17 14:38:10'),
(811, 798, 'LIST OF STAFF TO GET GUMBOOTS.docx', '2021-05-17 16:35:45', '2021-05-17 16:35:45'),
(812, 804, 'Kiambere posters 17-May-2021 18-43-43.pdf', '2021-05-18 05:26:19', '2021-05-18 05:26:19'),
(813, 793, 'INTELVISION QUOTE 01795.pdf', '2021-05-18 10:38:53', '2021-05-18 10:38:53'),
(814, 793, 'BASE CONTROL ROOM QUOTE.pdf', '2021-05-18 10:40:24', '2021-05-18 10:40:24'),
(815, 798, 'LIST OF STAFF TO GET GUMBOOTS.docx', '2021-05-18 14:42:30', '2021-05-18 14:42:30'),
(816, 642, 'BFA AND OFA PROGRAMES.pdf', '2021-05-18 15:21:07', '2021-05-18 15:21:07'),
(817, 642, 'First Aid training participants 18-May-2021 15-12-10.pdf', '2021-05-18 15:23:40', '2021-05-18 15:23:40'),
(818, 786, 'Quotation_Mantrac_180521.pdf', '2021-05-18 15:27:04', '2021-05-18 15:27:04'),
(819, 742, 'LIST OF STAFF TO GET T.SHIRTS.docx', '2021-05-18 15:35:54', '2021-05-18 15:35:54'),
(820, 752, 'LIST OF STAFF TO GET OVERALLS.docx', '2021-05-18 15:52:13', '2021-05-18 15:52:13'),
(821, 787, 'Quotation_Mantrac_180521.pdf', '2021-05-18 16:42:49', '2021-05-18 16:42:49'),
(822, 806, 'Sickle image.jpg', '2021-05-18 16:56:46', '2021-05-18 16:56:46'),
(823, 807, 'BatteriesQuote02-23-2021 11.18_1.pdf', '2021-05-18 20:52:12', '2021-05-18 20:52:12'),
(824, 805, 'cabinet costing 19-May-2021 07-54-39.pdf', '2021-05-19 08:00:16', '2021-05-19 08:00:16'),
(825, 798, 'Screenshot_20210519-081906_1.png', '2021-05-19 10:11:31', '2021-05-19 10:11:31'),
(826, 798, 'Screenshot_20210519-082016_1.png', '2021-05-19 10:11:31', '2021-05-19 10:11:31'),
(827, 798, 'Screenshot_20210519-081926_1.png', '2021-05-19 10:11:31', '2021-05-19 10:11:31'),
(828, 798, 'Screenshot_20210519-081823_1.png', '2021-05-19 10:11:32', '2021-05-19 10:11:32'),
(829, 786, 'Stock Form190521.xlsx', '2021-05-19 14:14:03', '2021-05-19 14:14:03'),
(830, 787, 'Stock Form190521.xlsx', '2021-05-19 14:30:59', '2021-05-19 14:30:59'),
(831, 783, 'Toyota Parts.pdf', '2021-05-19 15:27:57', '2021-05-19 15:27:57'),
(832, 812, 'IMG-20210519-WA0005.jpg', '2021-05-19 15:56:00', '2021-05-19 15:56:00'),
(833, 812, 'LIST OF STAFF TO GET T.SHIRTS.docx', '2021-05-19 15:59:25', '2021-05-19 15:59:25'),
(835, 808, 'Est_644_from_CAPTURE_SOLUTIONS_LTD_3352.pdf', '2021-05-19 16:18:31', '2021-05-19 16:18:31'),
(836, 803, 'Stock Form190521.xlsx', '2021-05-19 16:27:27', '2021-05-19 16:27:27'),
(837, 813, 'WhatsApp Image 2021-05-19 at 10.05.33.jpeg', '2021-05-19 21:42:43', '2021-05-19 21:42:43'),
(838, 813, 'Brush_Cutter_Demo.pdf', '2021-05-19 21:45:29', '2021-05-19 21:45:29'),
(839, 814, 'document(8).pdf', '2021-05-19 21:57:29', '2021-05-19 21:57:29'),
(840, 814, 'WhatsApp Image 2021-05-19 at 10.06.17.jpeg', '2021-05-19 22:01:11', '2021-05-19 22:01:11'),
(842, 808, 'BGF3.pdf', '2021-05-20 09:02:41', '2021-05-20 09:02:41'),
(843, 815, 'Statement AS at 20th May 2021.pdf', '2021-05-20 09:30:23', '2021-05-20 09:30:23'),
(844, 816, 'photo 1.jpg', '2021-05-20 09:44:33', '2021-05-20 09:44:33'),
(845, 816, 'photo 2.jpg', '2021-05-20 09:44:33', '2021-05-20 09:44:33'),
(846, 816, 'photo 3.jpg', '2021-05-20 09:44:33', '2021-05-20 09:44:33'),
(848, 818, 'BASE CONTROL ROOM QUOTE.pdf', '2021-05-20 10:24:02', '2021-05-20 10:24:02'),
(849, 818, 'TWO WAY RADIOS QUOTE.pdf', '2021-05-20 10:24:20', '2021-05-20 10:24:20'),
(850, 818, 'INTELVISION QUOTE 01795.pdf', '2021-05-20 10:24:38', '2021-05-20 10:24:38'),
(851, 818, 'VCARE SOLUTIONS.docx', '2021-05-20 10:25:04', '2021-05-20 10:25:04'),
(852, 810, 'CAPTURE_SOLUTIONS_LTD_3352.pdf', '2021-05-20 11:14:49', '2021-05-20 11:14:49'),
(853, 820, 'CAPTURE_SOLUTIONS_LTD_3352.pdf', '2021-05-20 11:44:55', '2021-05-20 11:44:55'),
(854, 822, 'Q-35907 - Better Globe Forestry Ltd. - 20_05_2021.pdf', '2021-05-20 12:10:17', '2021-05-20 12:10:17'),
(855, 822, 'Stock Form200521.xlsx', '2021-05-20 12:32:59', '2021-05-20 12:32:59'),
(856, 824, 'BETTER GLOBE(1).pdf', '2021-05-20 13:08:18', '2021-05-20 13:08:18'),
(857, 824, 'Radiator-Cores.pdf', '2021-05-20 13:26:16', '2021-05-20 13:26:16'),
(858, 825, 'Down Stairs Printer Job Card.pdf', '2021-05-20 15:14:13', '2021-05-20 15:14:13'),
(859, 825, 'Printer Ticket Log.docx', '2021-05-20 15:14:13', '2021-05-20 15:14:13'),
(860, 829, 'BASE CONTROL ROOM QUOTE.pdf', '2021-05-20 15:57:00', '2021-05-20 15:57:00'),
(861, 830, 'BETTER GLOBE QUOTATION _WACHIRA\'S TOOLS200521.pdf', '2021-05-20 15:59:45', '2021-05-20 15:59:45'),
(862, 829, 'TWO WAY RADIOS QUOTE.pdf', '2021-05-20 16:01:24', '2021-05-20 16:01:24'),
(863, 829, 'VCARE SOLUTIONS.docx', '2021-05-20 16:09:23', '2021-05-20 16:09:23'),
(864, 829, 'INTELVISION QUOTE 01795.pdf', '2021-05-20 16:14:59', '2021-05-20 16:14:59'),
(865, 831, 'document(9).pdf', '2021-05-21 11:35:09', '2021-05-21 11:35:09'),
(866, 832, 'NYO-MOTORBIKE-REPAIRS090521.xlsx', '2021-05-21 12:47:13', '2021-05-21 12:47:13'),
(867, 833, 'PORTWEST OAK POWERSAW GLOVES A290.pdf', '2021-05-22 07:45:11', '2021-05-22 07:45:11'),
(868, 833, 'BASE BISON TOP B0741 PLATINUM SAFETY BOOT.pdf', '2021-05-22 07:45:11', '2021-05-22 07:45:11'),
(869, 833, 'click forestry kit.pdf', '2021-05-22 07:45:11', '2021-05-22 07:45:11'),
(870, 833, 'Estimate_20215321_from_UNIPRO_LIMITED.pdf', '2021-05-22 07:45:11', '2021-05-22 07:45:11'),
(871, 833, 'PORTWEST OAK CHAINSAW JACKET CH10.pdf', '2021-05-22 07:45:11', '2021-05-22 07:45:11'),
(872, 833, 'PORTWEST OAK CHAINSAW TROUSER  CH11.pdf', '2021-05-22 07:45:11', '2021-05-22 07:45:11'),
(873, 790, 'CamScanner 05-22-2021 18.18.pdf', '2021-05-22 18:26:44', '2021-05-22 18:26:44'),
(874, 834, 'document(12).pdf', '2021-05-22 20:00:02', '2021-05-22 20:00:02'),
(875, 834, 'CamScanner 05-22-2021 19.49.pdf', '2021-05-22 20:02:03', '2021-05-22 20:02:03'),
(876, 835, 'WhatsApp Image 2021-05-11 at 8.18.30 AM (2).jpeg', '2021-05-23 08:29:35', '2021-05-23 08:29:35'),
(877, 837, 'Solar installation labour 23-May-2021 18-13-42.pdf', '2021-05-23 18:17:00', '2021-05-23 18:17:00'),
(878, 839, 'Paints-Marking.pdf', '2021-05-24 09:06:13', '2021-05-24 09:06:13'),
(879, 840, 'D16_Quote..pdf', '2021-05-24 11:49:20', '2021-05-24 11:49:20'),
(880, 841, 'Donkey-Carts2021.jpeg', '2021-05-24 12:08:36', '2021-05-24 12:08:36'),
(881, 838, 'WhatsApp Image 2021-05-15 at 9.29.08 AM (1).jpeg', '2021-05-24 12:14:11', '2021-05-24 12:14:11'),
(882, 842, 'Chemical Store &Toilet Materials.pdf', '2021-05-24 12:39:31', '2021-05-24 12:39:31'),
(883, 843, 'Signposts(3).pdf', '2021-05-24 14:36:20', '2021-05-24 14:36:20'),
(884, 845, 'CamScanner 05-24-2021 16.04.pdf', '2021-05-24 16:38:33', '2021-05-24 16:38:33'),
(885, 847, 'IMG-20210519-WA0006.jpg', '2021-05-25 11:05:43', '2021-05-25 11:05:43'),
(886, 847, 'LIST OF STAFF TO GET OVERALLS.docx', '2021-05-25 11:10:20', '2021-05-25 11:10:20'),
(887, 848, 'Kasalu Quote 26-May-2021 06-07-50.pdf', '2021-05-26 06:36:11', '2021-05-26 06:36:11'),
(888, 849, 'QUOTATION FOR PRUNING SAW AND PRUNING SHEAR 21-Apr-2021 10-20-37(2).pdf', '2021-05-26 06:48:33', '2021-05-26 06:48:33'),
(889, 819, 'doc02962220210526150641.pdf', '2021-05-26 15:25:58', '2021-05-26 15:25:58'),
(890, 823, 'doc02962420210526150734.pdf', '2021-05-26 15:26:32', '2021-05-26 15:26:32'),
(891, 811, 'doc02962120210526150614.pdf', '2021-05-26 15:27:38', '2021-05-26 15:27:38'),
(892, 852, 'Delights Quote 26.pdf', '2021-05-26 15:39:09', '2021-05-26 15:39:09'),
(893, 796, 'doc02962620210526153926.pdf', '2021-05-26 15:46:27', '2021-05-26 15:46:27'),
(894, 849, 'WhatsApp Image 2021-05-26 at 6.02.53 PM (1).jpeg', '2021-05-26 18:06:34', '2021-05-26 18:06:34'),
(895, 849, 'WhatsApp Image 2021-05-26 at 6.02.53 PM.jpeg', '2021-05-26 18:06:34', '2021-05-26 18:06:34'),
(896, 849, 'WhatsApp Image 2021-05-26 at 6.02.52 PM (1).jpeg', '2021-05-26 18:06:34', '2021-05-26 18:06:34'),
(897, 849, 'WhatsApp Image 2021-05-26 at 6.02.52 PM.jpeg', '2021-05-26 18:06:34', '2021-05-26 18:06:34'),
(898, 854, 'Machines breakdown reporting 30042021.xlsx', '2021-05-27 07:05:42', '2021-05-27 07:05:42'),
(899, 854, 'Quotation Bishop-s May 27-May-2021 06-47-45.pdf', '2021-05-27 07:05:42', '2021-05-27 07:05:42'),
(900, 855, 'Machines breakdown reporting 30042021.xlsx', '2021-05-27 07:09:28', '2021-05-27 07:09:28'),
(901, 855, 'Quotation Bishop-s May 27-May-2021 06-47-45.pdf', '2021-05-27 07:09:28', '2021-05-27 07:09:28'),
(902, 855, 'Machines breakdown reporting 30042021.xlsx', '2021-05-27 07:09:34', '2021-05-27 07:09:34'),
(903, 855, 'Quotation Bishop-s May 27-May-2021 06-47-45.pdf', '2021-05-27 07:09:34', '2021-05-27 07:09:34'),
(904, 856, 'Jay-Kay-Quotation270521.pdf', '2021-05-27 09:45:34', '2021-05-27 09:45:34'),
(905, 857, 'Estimate_20215321_from_UNIPRO_LIMITED_270521.pdf', '2021-05-27 10:08:09', '2021-05-27 10:08:09'),
(906, 825, 'BETTERGLOBE FORESTRY QUOTE FOR kyocera 2035 consumables  2021.doc', '2021-05-27 11:34:01', '2021-05-27 11:34:01'),
(907, 844, 'CamScanner 05-27-2021 12.47.pdf', '2021-05-27 12:57:54', '2021-05-27 12:57:54'),
(908, 859, 'Marking Wire-Specialised Hardwares.pdf', '2021-05-28 15:54:53', '2021-05-28 15:54:53'),
(909, 860, 'JAC-KENYA.pdf', '2021-05-28 20:55:57', '2021-05-28 20:55:57'),
(910, 861, 'document(14).pdf', '2021-05-28 21:29:00', '2021-05-28 21:29:00'),
(911, 862, 'CamScanner 05-30-2021 14.29.pdf', '2021-05-30 14:32:37', '2021-05-30 14:32:37'),
(912, 864, 'document(15).pdf', '2021-05-30 15:43:06', '2021-05-30 15:43:06'),
(913, 865, 'Quote290521.pdf', '2021-05-30 20:21:39', '2021-05-30 20:21:39'),
(914, 866, 'Proforma Invoice Hanji\'s 2.pdf', '2021-05-31 10:10:52', '2021-05-31 10:10:52'),
(915, 867, 'CamScanner 05-31-2021 11.20.pdf', '2021-05-31 11:29:29', '2021-05-31 11:29:29'),
(916, 868, 'Quotation metallic cabinet 31-May-2021 10-29-55.pdf', '2021-05-31 11:29:46', '2021-05-31 11:29:46'),
(917, 869, 'CamScanner 05-31-2021 16.38.pdf', '2021-05-31 17:11:30', '2021-05-31 17:11:30'),
(918, 870, 'CamScanner 05-31-2021 18.47.pdf', '2021-05-31 19:31:39', '2021-05-31 19:31:39'),
(919, 870, 'MOTORBIKES BREAKDOWN AS AT 20210414 DKL.xlsx', '2021-05-31 19:35:31', '2021-05-31 19:35:31'),
(920, 871, 'BGF-Quotation_Oils.pdf', '2021-06-01 20:01:36', '2021-06-01 20:01:36'),
(921, 872, 'Solar installation quote 30-Apr-2021 14-56-37 Page 1.pdf', '2021-06-01 20:22:32', '2021-06-01 20:22:32'),
(922, 874, 'Jograna quote(1) 01-Jun-2021 20-29-30.pdf', '2021-06-01 20:41:24', '2021-06-01 20:41:24'),
(923, 875, 'Motorbike-QUOTE.pdf', '2021-06-01 20:43:33', '2021-06-01 20:43:33'),
(924, 875, 'file.xlsx', '2021-06-01 20:48:22', '2021-06-01 20:48:22'),
(925, 876, 'Jograna quote(1) 01-Jun-2021 20-29-30.pdf', '2021-06-01 20:49:20', '2021-06-01 20:49:20'),
(928, 878, 'CATD6T-XL.pdf', '2021-06-02 09:11:33', '2021-06-02 09:11:33'),
(929, 879, 'sample business card_1.pdf', '2021-06-02 10:25:48', '2021-06-02 10:25:48'),
(930, 874, 'STOCK FORM REPORT KIA 7F-April.xlsx', '2021-06-02 10:37:45', '2021-06-02 10:37:45'),
(931, 882, 'GK 7Forks Field Visit 210526.xlsx', '2021-06-02 12:38:47', '2021-06-02 12:38:47'),
(932, 853, 'Tarda ME.jpg', '2021-06-02 13:03:09', '2021-06-02 13:03:09'),
(933, 853, 'ideal ME.jpg', '2021-06-02 13:03:48', '2021-06-02 13:03:48'),
(934, 858, 'Tarda IT.jpg', '2021-06-02 13:07:07', '2021-06-02 13:07:07'),
(935, 858, 'ideal IT.jpg', '2021-06-02 13:07:23', '2021-06-02 13:07:23'),
(936, 883, 'Thermometer 2021.pdf', '2021-06-02 13:23:51', '2021-06-02 13:23:51'),
(937, 884, 'Mower 2021.pdf', '2021-06-02 13:30:26', '2021-06-02 13:30:26'),
(938, 884, 'IMG-20210602-WA0002.jpg', '2021-06-02 13:32:38', '2021-06-02 13:32:38'),
(939, 885, 'DKL site Inspection program June 2021.xlsx', '2021-06-02 13:33:48', '2021-06-02 13:33:48'),
(940, 873, 'Solar installation quote 30-Apr-2021 14-56-37 Page 1.pdf', '2021-06-02 15:18:38', '2021-06-02 15:18:38'),
(941, 833, 'PPE sizes.xlsx', '2021-06-02 15:28:41', '2021-06-02 15:28:41'),
(942, 876, 'STOCK FORM REPORT KIA 7F-April.xlsx', '2021-06-02 15:30:18', '2021-06-02 15:30:18'),
(943, 873, 'Solar installation labour 23-May-2021 18-13-42 (2).pdf', '2021-06-02 16:02:16', '2021-06-02 16:02:16'),
(944, 882, 'ideal Gideon.jpg', '2021-06-02 18:42:42', '2021-06-02 18:42:42'),
(945, 829, 'FW WALKIE TALKIES.msg', '2021-06-03 10:00:53', '2021-06-03 10:00:53'),
(946, 756, 'List of farmers -fruit collection.ods', '2021-06-04 09:56:52', '2021-06-04 09:56:52'),
(947, 889, 'doc02977120210604101038.pdf', '2021-06-04 10:17:11', '2021-06-04 10:17:11'),
(948, 890, 'document(19).pdf', '2021-06-04 10:35:14', '2021-06-04 10:35:14'),
(949, 891, 'BETTER GLOBE 268X 275X RPU1500.pdf', '2021-06-04 11:14:18', '2021-06-04 11:14:18'),
(950, 892, 'BETTER GLOBE FORESTRY(1).pdf', '2021-06-04 11:17:15', '2021-06-04 11:17:15'),
(951, 891, 'Stock Form280521.xlsx', '2021-06-04 12:09:54', '2021-06-04 12:09:54'),
(952, 885, 'Garden inn.jpg', '2021-06-04 12:09:57', '2021-06-04 12:09:57'),
(953, 885, 'La palm.jpg', '2021-06-04 12:30:12', '2021-06-04 12:30:12'),
(954, 885, 'DOKOLO.jpg', '2021-06-04 12:30:38', '2021-06-04 12:30:38'),
(955, 893, 'FIRST AID KIT CONTENTS REPLENISH.pdf', '2021-06-05 12:21:32', '2021-06-05 12:21:32'),
(956, 894, 'RED CROSS-KENYA(1ST AID TRAINING NYONGORO).pdf', '2021-06-05 14:52:32', '2021-06-05 14:52:32'),
(957, 894, 'Nyongoro-List of First Aid Trainees060521.xlsx', '2021-06-05 15:22:05', '2021-06-05 15:22:05');
INSERT INTO `images` (`id`, `todo_id`, `image`, `created_at`, `updated_at`) VALUES
(958, 895, 'camscanner 06-05-2021 15.46.pdf', '2021-06-05 15:50:32', '2021-06-05 15:50:32'),
(959, 896, 'RIDERS SUITS.xlsx', '2021-06-05 20:08:17', '2021-06-05 20:08:17'),
(960, 898, 'Fuel consumption April May 06-Jun-2021 21-29-47.pdf', '2021-06-06 21:41:12', '2021-06-06 21:41:12'),
(962, 899, 'BalancesOnCards (11).PDF', '2021-06-07 14:57:59', '2021-06-07 14:57:59'),
(963, 804, 'Quotation 070 - Betterglobe.pdf', '2021-06-09 09:52:35', '2021-06-09 09:52:35'),
(964, 795, 'Quotation 070 - Betterglobe.pdf', '2021-06-09 10:30:47', '2021-06-09 10:30:47'),
(965, 900, '#QUOTE-00043.pdf', '2021-06-09 10:37:37', '2021-06-09 10:37:37'),
(966, 902, 'BalancesOnCards (13).PDF', '2021-06-09 10:52:45', '2021-06-09 10:52:45'),
(967, 899, 'BalancesOnCards (11).PDF', '2021-06-09 15:38:31', '2021-06-09 15:38:31'),
(968, 899, 'BalancesOnCards (12).PDF', '2021-06-09 15:38:57', '2021-06-09 15:38:57'),
(969, 899, 'BalancesOnCards (13).PDF', '2021-06-09 15:39:15', '2021-06-09 15:39:15'),
(970, 903, 'BETTER GLOBE TYRE & TUBE.pdf', '2021-06-10 08:26:46', '2021-06-10 08:26:46'),
(971, 871, 'Stock Balance-2T&4T.pdf', '2021-06-10 09:07:09', '2021-06-10 09:07:09'),
(972, 904, 'IDEAL PLACE D.jpg', '2021-06-10 11:00:11', '2021-06-10 11:00:11'),
(973, 885, 'LA PALM ALEX 1.pdf', '2021-06-11 11:22:56', '2021-06-11 11:22:56'),
(974, 885, 'LA PALM ALEX 2.pdf', '2021-06-11 11:23:30', '2021-06-11 11:23:30'),
(976, 896, 'toyota.pdf', '2021-06-11 12:21:16', '2021-06-11 12:21:16'),
(977, 885, 'LA PALM ALEX 1.pdf', '2021-06-11 12:33:39', '2021-06-11 12:33:39'),
(978, 746, 'PowerSaw-Expenditures2019-2021.xlsx', '2021-06-11 16:20:15', '2021-06-11 16:20:15'),
(979, 906, 'CamScanner 06-12-2021 10.57.pdf', '2021-06-12 11:12:52', '2021-06-12 11:12:52'),
(980, 907, 'KAL QUOTATION BETTER GLOBE FORESTRY - KMFB 001T - 07-06-21.pdf', '2021-06-12 12:03:29', '2021-06-12 12:03:29'),
(981, 908, 'document(20).pdf', '2021-06-14 15:41:30', '2021-06-14 15:41:30'),
(982, 911, 'Toyota Quote.pdf', '2021-06-15 11:49:53', '2021-06-15 11:49:53'),
(983, 912, 'Toyota quote 2.pdf', '2021-06-15 12:05:09', '2021-06-15 12:05:09'),
(984, 913, 'Toyota QAuote 3.pdf', '2021-06-15 12:28:20', '2021-06-15 12:28:20'),
(985, 914, 'Toyota Quote 4.pdf', '2021-06-15 14:10:48', '2021-06-15 14:10:48'),
(986, 916, 'CamScanner 06-15-2021 16.58.pdf', '2021-06-15 17:07:21', '2021-06-15 17:07:21'),
(987, 917, 'PDF Scanner 15-06-21 3.35.17.pdf', '2021-06-16 10:32:51', '2021-06-16 10:32:51'),
(988, 918, 'CamScanner 06-16-2021 10.39.pdf', '2021-06-16 11:01:13', '2021-06-16 11:01:13'),
(989, 918, 'Control Room_Electric Fence.pdf', '2021-06-16 11:08:19', '2021-06-16 11:08:19'),
(990, 919, 'Gas-Recharge-Quote.pdf', '2021-06-16 11:32:32', '2021-06-16 11:32:32'),
(991, 920, 'CamScanner 06-16-2021 12.31.pdf', '2021-06-16 12:37:27', '2021-06-16 12:37:27'),
(992, 921, 'CamScanner 06-16-2021 13.02.pdf', '2021-06-16 13:07:39', '2021-06-16 13:07:39'),
(993, 922, 'Diagnosis report for DTEdwin.jpg', '2021-06-16 13:24:44', '2021-06-16 13:24:44'),
(994, 921, 'Auger-Frame.pdf', '2021-06-16 14:01:47', '2021-06-16 14:01:47'),
(995, 920, 'Stock Form110621.xlsx', '2021-06-17 11:44:12', '2021-06-17 11:44:12'),
(996, 925, 'CamScanner 06-17-2021 12.17.pdf', '2021-06-17 12:37:43', '2021-06-17 12:37:43'),
(997, 926, 'F.A Training Invoice.pdf', '2021-06-17 12:54:23', '2021-06-17 12:54:23'),
(998, 930, 'Wooden handle sickle.jpg', '2021-06-18 11:59:49', '2021-06-18 11:59:49'),
(999, 931, 'CamScanner 06-18-2021 12.09.pdf', '2021-06-18 12:16:48', '2021-06-18 12:16:48'),
(1001, 933, 'CamScanner 06-18-2021 12.38.pdf', '2021-06-18 12:41:06', '2021-06-18 12:41:06'),
(1002, 934, 'consent letter, Pope.docx', '2021-06-18 13:51:47', '2021-06-18 13:51:47'),
(1003, 935, 'Electric link.pdf', '2021-06-18 14:57:16', '2021-06-18 14:57:16'),
(1004, 930, 'CamScanner 06-18-2021 15.46.pdf', '2021-06-18 15:51:02', '2021-06-18 15:51:02'),
(1005, 936, 'Scorpio Villas FOD.doc', '2021-06-18 16:12:43', '2021-06-18 16:12:43'),
(1006, 937, 'New Document(9) 18-Jun-2021 11-08-02 (1).pdf', '2021-06-18 16:30:25', '2021-06-18 16:30:25'),
(1007, 938, 'concent letter.docx', '2021-06-19 13:39:24', '2021-06-19 13:39:24'),
(1008, 939, 'Fruit collection quotation.pdf', '2021-06-21 10:16:27', '2021-06-21 10:16:27'),
(1009, 940, 'Fruit collection quotation.pdf', '2021-06-21 11:07:01', '2021-06-21 11:07:01'),
(1010, 877, 'doc02995920210621114139.pdf', '2021-06-21 11:51:52', '2021-06-21 11:51:52'),
(1011, 926, 'LIST OF STAFF TO BE TRAINED.docx', '2021-06-21 11:59:30', '2021-06-21 11:59:30'),
(1014, 922, 'Office Mart SSD HDD.pdf', '2021-06-21 12:46:18', '2021-06-21 12:46:18'),
(1015, 942, 'TRUCK SHADE COSTING.xlsx', '2021-06-21 13:04:25', '2021-06-21 13:04:25'),
(1016, 941, 'Q-57642 - Better Globe Forestry Ltd. - 21_06_2021.pdf', '2021-06-21 13:46:28', '2021-06-21 13:46:28'),
(1017, 943, 'Grease-Quote.pdf', '2021-06-22 13:37:48', '2021-06-22 13:37:48'),
(1018, 943, 'Q-58072 - Better Globe Forestry Ltd. - 22_06_2021.pdf', '2021-06-22 13:39:59', '2021-06-22 13:39:59'),
(1019, 944, 'LIST OF STAFF TO BE TRAINED.docx', '2021-06-22 16:06:33', '2021-06-22 16:06:33'),
(1020, 945, 'Doc.pdf', '2021-06-22 19:29:20', '2021-06-22 19:29:20'),
(1021, 946, 'CamScanner 06-22-2021 19.59.pdf', '2021-06-22 20:07:32', '2021-06-22 20:07:32'),
(1022, 947, 'CamScanner 06-22-2021 20.21.pdf', '2021-06-22 20:33:29', '2021-06-22 20:33:29'),
(1023, 949, 'CamScanner 06-22-2021.pdf', '2021-06-22 20:52:46', '2021-06-22 20:52:46'),
(1024, 950, 'Kiambere site inspection schedule-June 2021.xlsx', '2021-06-24 13:02:40', '2021-06-24 13:02:40'),
(1025, 945, 'milk 1.jpg', '2021-06-25 01:40:06', '2021-06-25 01:40:06'),
(1026, 945, 'milk 2.jpg', '2021-06-25 01:41:34', '2021-06-25 01:41:34'),
(1027, 951, 'CamScanner 06-25-2021 10.02 (1).pdf', '2021-06-25 10:56:22', '2021-06-25 10:56:22'),
(1028, 952, 'CamScanner 06-25-2021 10.02.pdf', '2021-06-25 11:35:46', '2021-06-25 11:35:46'),
(1029, 954, 'Mugendi stores detergent quotation 25-Jun-2021 11-54-40.pdf', '2021-06-25 12:01:06', '2021-06-25 12:01:06'),
(1030, 943, 'CamScanner 06-25-2021 17.04.pdf', '2021-06-25 17:07:00', '2021-06-25 17:07:00'),
(1032, 950, 'Tarda Henry.jpeg', '2021-06-26 14:04:08', '2021-06-26 14:04:08'),
(1033, 948, 'tana delta 1.jpg', '2021-06-26 14:25:46', '2021-06-26 14:25:46'),
(1034, 964, 'tana delta 2.jpg', '2021-06-26 14:38:57', '2021-06-26 14:38:57'),
(1035, 964, 'tana delta 1.jpg', '2021-06-26 14:40:10', '2021-06-26 14:40:10'),
(1036, 942, 'PDF Scanner 23-06-21 11.05.30.pdf', '2021-06-26 14:51:01', '2021-06-26 14:51:01'),
(1037, 917, 'PDF Scanner 16-06-21 10.21.41 (1).pdf', '2021-06-26 14:56:11', '2021-06-26 14:56:11'),
(1038, 944, 'CamScanner 06-26-2021 17.08.pdf', '2021-06-26 19:01:54', '2021-06-26 19:01:54'),
(1039, 961, 'Mantrac - 28_06_2021.pdf', '2021-06-28 13:36:39', '2021-06-28 13:36:39'),
(1040, 965, 'Surgical gloves quotation 28-Jun-2021 15-28-45.pdf', '2021-06-28 15:35:07', '2021-06-28 15:35:07'),
(1041, 965, 'Chemicals quotation.docx', '2021-06-28 15:35:07', '2021-06-28 15:35:07'),
(1042, 967, 'Surgical gloves quotation 28-Jun-2021 15-28-45.pdf', '2021-06-28 15:36:31', '2021-06-28 15:36:31'),
(1043, 967, 'Chemicals quotation.docx', '2021-06-28 15:36:31', '2021-06-28 15:36:31'),
(1044, 953, 'BASH BASH.pdf', '2021-06-29 08:48:14', '2021-06-29 08:48:14'),
(1045, 922, 'Shop IT Quote.pdf', '2021-06-29 08:54:57', '2021-06-29 08:54:57'),
(1046, 969, 'doc03005620210629114447.pdf', '2021-06-29 11:56:23', '2021-06-29 11:56:23'),
(1047, 970, 'doc03005720210629114507.pdf', '2021-06-29 12:06:45', '2021-06-29 12:06:45'),
(1048, 923, 'WhatsApp Image 2021-06-29 at 10.50.56 (1).jpeg', '2021-06-29 13:01:18', '2021-06-29 13:01:18'),
(1049, 973, 'doc03006020210629121500.pdf', '2021-06-29 13:53:00', '2021-06-29 13:53:00'),
(1050, 974, 'doc03006120210629121523.pdf', '2021-06-29 14:01:54', '2021-06-29 14:01:54'),
(1051, 976, 'doc03006320210629121605.pdf', '2021-06-29 14:23:34', '2021-06-29 14:23:34'),
(1052, 975, 'DW.pdf', '2021-06-29 14:36:46', '2021-06-29 14:36:46'),
(1053, 975, 'DW.pdf', '2021-06-29 14:40:56', '2021-06-29 14:40:56'),
(1054, 977, 'doc03007120210629145519.pdf', '2021-06-29 15:01:20', '2021-06-29 15:01:20'),
(1055, 978, 'doc03007420210629154445.pdf', '2021-06-29 15:55:15', '2021-06-29 15:55:15'),
(1056, 979, 'doc03007420210629154445.pdf', '2021-06-29 15:55:22', '2021-06-29 15:55:22'),
(1057, 980, 'doc03007920210629160326.pdf', '2021-06-29 16:09:17', '2021-06-29 16:09:17'),
(1058, 968, 'CamScanner 06-29-2021 16.36.pdf', '2021-06-29 16:43:15', '2021-06-29 16:43:15'),
(1059, 981, 'CamScanner 06-30-2021 17.00.pdf', '2021-06-30 19:18:52', '2021-06-30 19:18:52'),
(1060, 982, 'Brush Cutter.pdf', '2021-07-01 10:23:52', '2021-07-01 10:23:52'),
(1061, 923, 'ideal 1 haraka.jpeg', '2021-07-01 11:52:19', '2021-07-01 11:52:19'),
(1062, 923, 'ideal 2 haraka.jpeg', '2021-07-01 11:52:52', '2021-07-01 11:52:52'),
(1063, 923, 'tarda Haraka.jpeg', '2021-07-01 11:53:06', '2021-07-01 11:53:06'),
(1064, 983, 'Sophos-xg115-#QUOTE-00066.pdf', '2021-07-01 12:26:23', '2021-07-01 12:26:23'),
(1065, 984, 'Kiambere brush cutter.pdf', '2021-07-01 13:22:25', '2021-07-01 13:22:25'),
(1066, 985, 'CamScanner 07-02-2021 09.49.pdf', '2021-07-02 09:53:49', '2021-07-02 09:53:49'),
(1067, 986, 'BalancesOnCards (16).PDF', '2021-07-02 11:43:26', '2021-07-02 11:43:26'),
(1068, 987, 'CamScanner 07-03-2021 09.34.pdf', '2021-07-03 13:18:45', '2021-07-03 13:18:45'),
(1069, 879, 'Reality invoice.jpg', '2021-07-05 11:46:57', '2021-07-05 11:46:57'),
(1070, 989, 'Reality invoice.jpg', '2021-07-05 12:16:30', '2021-07-05 12:16:30'),
(1071, 990, 'BASH BASH RESTAURANT-WITU.pdf', '2021-07-06 13:54:00', '2021-07-06 13:54:00'),
(1072, 996, 'Copy of Copy of INVENTORY LIST.xlsx', '2021-07-07 13:05:47', '2021-07-07 13:05:47'),
(1073, 998, 'AAs Vetting HO meeting 210708.xlsx', '2021-07-08 12:39:21', '2021-07-08 12:39:21'),
(1074, 999, 'AAs Vetting HO meeting 210708.xlsx', '2021-07-08 12:39:22', '2021-07-08 12:39:22'),
(1075, 1000, 'AAs Vetting HO meeting 210708.xlsx', '2021-07-08 12:39:24', '2021-07-08 12:39:24'),
(1076, 1001, 'AAs Vetting HO meeting 210708.xlsx', '2021-07-08 12:39:25', '2021-07-08 12:39:25'),
(1077, 1002, 'AAs Vetting HO meeting 210708.xlsx', '2021-07-08 12:39:27', '2021-07-08 12:39:27'),
(1078, 1003, 'AAs Vetting HO meeting 210708.xlsx', '2021-07-08 12:39:28', '2021-07-08 12:39:28'),
(1079, 1004, 'AAs Vetting HO meeting 210708.xlsx', '2021-07-08 12:39:49', '2021-07-08 12:39:49'),
(1080, 1005, 'AAs Vetting HO meeting 210708.xlsx', '2021-07-08 13:48:50', '2021-07-08 13:48:50'),
(1081, 1007, 'KAL QUOTATION BETTER GLOBE - KMFB 001T - 07-07-2021.pdf', '2021-07-08 23:51:48', '2021-07-08 23:51:48'),
(1082, 1008, 'Water Pump Parts.PNG', '2021-07-09 11:40:43', '2021-07-09 11:40:43'),
(1083, 1011, 'CamScanner 07-12-2021 15.14.pdf', '2021-07-12 15:23:40', '2021-07-12 15:23:40'),
(1084, 1024, 'New Document(5).pdf', '2021-07-12 15:34:55', '2021-07-12 15:34:55'),
(1085, 1011, 'Farm information sheet.xlsx', '2021-07-12 15:58:46', '2021-07-12 15:58:46'),
(1086, 1009, 'Dokolo tourist.pdf', '2021-07-13 09:41:26', '2021-07-13 09:41:26'),
(1087, 1026, 'QUO007136-Ramco.pdf', '2021-07-13 09:42:12', '2021-07-13 09:42:12'),
(1088, 1030, 'Proforma Invoice MITI 51-Shem.pdf', '2021-07-13 10:23:35', '2021-07-13 10:23:35'),
(1089, 1039, 'NESAK QUOTATION.pdf', '2021-07-13 12:11:48', '2021-07-13 12:11:48'),
(1090, 1041, '20210713_134942.jpg', '2021-07-13 14:22:58', '2021-07-13 14:22:58'),
(1091, 1042, 'Medicines.pdf', '2021-07-13 20:35:43', '2021-07-13 20:35:43'),
(1092, 1043, 'PADLOCKS.pdf', '2021-07-14 15:25:47', '2021-07-14 15:25:47'),
(1093, 1044, 'BETTER GLOBE QUOTATION 14.07.21.pdf', '2021-07-14 18:08:08', '2021-07-14 18:08:08'),
(1094, 1045, 'PDF Scanner 15-07-21 10.51.22.pdf', '2021-07-15 10:58:09', '2021-07-15 10:58:09'),
(1095, 1046, 'Jograna Quotation.jpeg', '2021-07-15 11:14:00', '2021-07-15 11:14:00'),
(1096, 1047, 'Kamuwongo gateway quotation- 15-Jul-2021 11-37-26.pdf', '2021-07-15 11:53:54', '2021-07-15 11:53:54'),
(1097, 1048, 'document(23).pdf', '2021-07-15 12:53:08', '2021-07-15 12:53:08'),
(1098, 1049, 'Gladiator_Quote.pdf', '2021-07-15 14:57:27', '2021-07-15 14:57:27'),
(1099, 1051, 'CamScanner 07-15-2021 16.17.pdf', '2021-07-16 09:25:32', '2021-07-16 09:25:32'),
(1100, 1041, 'HP 15 SCREEN steve.pdf', '2021-07-16 12:42:29', '2021-07-16 12:42:29'),
(1101, 1040, 'SCREEN QUOTE Henry.pdf', '2021-07-16 12:48:17', '2021-07-16 12:48:17'),
(1102, 1052, 'CamScanner 07-19-2021 10.09.pdf', '2021-07-19 10:26:27', '2021-07-19 10:26:27'),
(1103, 1053, 'CamScanner 07-19-2021 13.25.pdf', '2021-07-19 13:28:07', '2021-07-19 13:28:07'),
(1104, 1014, 'BETTERGLOBE  FORESTRY KCF 033F-25624-42136 INVOICE.xlsx', '2021-07-21 08:44:20', '2021-07-21 08:44:20'),
(1105, 1054, 'CamScanner 07-21-2021 10.13.pdf', '2021-07-21 13:17:23', '2021-07-21 13:17:23'),
(1107, 1056, 'KCF O33F.PDF', '2021-07-21 18:19:22', '2021-07-21 18:19:22'),
(1108, 1056, 'KCY 387F.PDF', '2021-07-21 18:26:13', '2021-07-21 18:26:13'),
(1109, 1056, 'KCY 995K.PDF', '2021-07-21 18:26:36', '2021-07-21 18:26:36'),
(1110, 1056, 'BalancesOnCards Generator.PDF', '2021-07-21 18:27:12', '2021-07-21 18:27:12'),
(1111, 1057, 'CamScanner 07-22-2021 08.59.pdf', '2021-07-22 09:02:26', '2021-07-22 09:02:26'),
(1112, 1058, 'Kamburu Quotation  22 Jul 2021.pdf', '2021-07-22 10:49:40', '2021-07-22 10:49:40'),
(1113, 1050, 'KIAMBERE.jpg', '2021-07-22 14:17:59', '2021-07-22 14:17:59'),
(1114, 1059, 'Kasalu (2).pdf', '2021-07-22 15:33:27', '2021-07-22 15:33:27'),
(1115, 1060, 'CamScanner 07-24-2021 10.15.pdf', '2021-07-24 10:25:55', '2021-07-24 10:25:55'),
(1116, 1061, 'document(24).pdf', '2021-07-24 10:41:23', '2021-07-24 10:41:23'),
(1117, 1061, 'CamScanner 07-24-2021 10.44.pdf', '2021-07-24 10:48:42', '2021-07-24 10:48:42'),
(1118, 1065, 'BETTER GLOBE CLUTCH PLATE_KTCB 154X.xlsx', '2021-07-24 12:13:44', '2021-07-24 12:13:44'),
(1119, 1065, 'MF 268 XTRA JULY QUOTE.pdf', '2021-07-24 12:19:02', '2021-07-24 12:19:02'),
(1120, 1066, 'Cash request for MTN mifi.docx', '2021-07-26 09:30:41', '2021-07-26 09:30:41'),
(1121, 1068, 'Paints-Quote.pdf', '2021-07-26 17:59:19', '2021-07-26 17:59:19'),
(1122, 1069, 'BASH BASH RESTAURANT-WITU.pdf', '2021-07-27 09:33:33', '2021-07-27 09:33:33'),
(1123, 1067, 'PDF Scanner 27-07-21 12.51.17.pdf', '2021-07-27 13:05:25', '2021-07-27 13:05:25'),
(1124, 1070, 'End of July radio talk show content.docx', '2021-07-27 16:35:10', '2021-07-27 16:35:10'),
(1125, 1070, 'PDF Scanner 27-07-21 12.51.17.pdf', '2021-07-28 08:13:38', '2021-07-28 08:13:38'),
(1126, 1072, 'Drinking_Water_Quote.pdf', '2021-08-02 08:01:44', '2021-08-02 08:01:44'),
(1127, 1073, 'Quote Toyota.jpeg', '2021-08-03 15:17:38', '2021-08-03 15:17:38'),
(1128, 1075, 'QUOTATION JACARANDA.jpg', '2021-08-04 16:05:59', '2021-08-04 16:05:59'),
(1129, 1075, 'INVOICE JACARANDA.jpg', '2021-08-04 16:07:50', '2021-08-04 16:07:50'),
(1130, 1076, 'Quote Toyota.jpeg', '2021-08-05 09:30:59', '2021-08-05 09:30:59'),
(1131, 1074, 'Shopping last month.pdf', '2021-08-05 12:00:18', '2021-08-05 12:00:18'),
(1132, 1078, 'BalancesOnCards (25).PDF', '2021-08-06 12:51:35', '2021-08-06 12:51:35'),
(1133, 1079, 'WhatsApp Image 2021-08-06 at 10.34.02.jpeg', '2021-08-06 12:55:08', '2021-08-06 12:55:08'),
(1134, 1080, 'Better Globe August 2021.pdf', '2021-08-08 18:28:35', '2021-08-08 18:28:35'),
(1135, 1081, 'CamScanner 08-06-2021 10.39.pdf', '2021-08-09 08:23:12', '2021-08-09 08:23:12'),
(1136, 1084, 'Photo of Safari Jacket.jpeg', '2021-08-09 12:45:30', '2021-08-09 12:45:30'),
(1137, 1085, 'BETTER GLOBE FORESTRY KCF 033F-25435-46574.xlsX', '2021-08-10 09:33:48', '2021-08-10 09:33:48'),
(1138, 1089, 'Quotation-NurseryFence.pdf', '2021-08-11 09:48:30', '2021-08-11 09:48:30'),
(1139, 1090, 'Drugs-Quote.pdf', '2021-08-11 10:04:56', '2021-08-11 10:04:56'),
(1140, 1082, 'Quatations.pdf', '2021-08-11 10:41:54', '2021-08-11 10:41:54'),
(1142, 1094, 'CamScanner 08-11-2021 16.11.pdf', '2021-08-11 16:32:20', '2021-08-11 16:32:20'),
(1143, 1095, 'Detergent quotation 11-Aug-2021 16-29-06.pdf', '2021-08-11 16:41:01', '2021-08-11 16:41:01'),
(1144, 1096, 'Detergent quotation 11-Aug-2021 16-29-06.pdf', '2021-08-11 16:47:08', '2021-08-11 16:47:08'),
(1145, 1097, 'Fun Ticket from Gideon.docx', '2021-08-13 15:35:31', '2021-08-13 15:35:31'),
(1146, 1097, 'Keyboard Ticket from Dalmas.docx', '2021-08-13 15:35:31', '2021-08-13 15:35:31'),
(1147, 1098, 'Jac-Kenya-Alternator.pdf', '2021-08-15 09:05:54', '2021-08-15 09:05:54'),
(1148, 1080, 'Wire Strainer_GALLAGHER.pdf', '2021-08-15 15:53:51', '2021-08-15 15:53:51'),
(1149, 1099, 'Paints-NurseryRaisedBeds.pdf', '2021-08-15 16:22:31', '2021-08-15 16:22:31'),
(1150, 1093, 'TARDA HARAKA.jpg', '2021-08-16 14:51:34', '2021-08-16 14:51:34'),
(1151, 1093, 'IDEAL HARAKA.jpg', '2021-08-16 14:52:16', '2021-08-16 14:52:16'),
(1152, 1086, 'PICK UP A.pdf', '2021-08-16 15:53:47', '2021-08-16 15:53:47'),
(1153, 1085, 'PICK UP B.pdf', '2021-08-16 16:01:09', '2021-08-16 16:01:09'),
(1154, 1100, 'safari check.pdf', '2021-08-16 16:13:41', '2021-08-16 16:13:41'),
(1155, 1101, 'CamScanner 08-09-2021 08.27.pdf', '2021-08-17 09:26:18', '2021-08-17 09:26:18'),
(1156, 1101, 'MOTORBIKES BREAKDOWN AS AT 20210817 DKL.xlsx', '2021-08-17 09:36:47', '2021-08-17 09:36:47'),
(1157, 1095, 'Stock Record.PNG', '2021-08-17 09:40:01', '2021-08-17 09:40:01'),
(1158, 958, 'BETTER G.pdf', '2021-08-17 12:16:18', '2021-08-17 12:16:18'),
(1159, 1083, 'Scan 17 Aug 1219.pdf', '2021-08-17 13:22:35', '2021-08-17 13:22:35'),
(1160, 1102, 'Hand washing gel.pdf', '2021-08-17 17:42:28', '2021-08-17 17:42:28'),
(1161, 1103, 'CamScanner 08-17-2021 18.09.pdf', '2021-08-17 18:14:06', '2021-08-17 18:14:06'),
(1162, 1104, 'CamScanner 08-17-2021 18.10.pdf', '2021-08-17 18:30:59', '2021-08-17 18:30:59'),
(1163, 1102, 'Stock Record.PNG', '2021-08-18 06:25:22', '2021-08-18 06:25:22'),
(1164, 1105, 'Plumbing Quotations.pdf', '2021-08-18 15:25:52', '2021-08-18 15:25:52'),
(1165, 1106, 'Quatations.pdf', '2021-08-18 16:05:43', '2021-08-18 16:05:43'),
(1166, 1097, 'QUOTE BETTER GLOBE.pdf', '2021-08-19 14:00:03', '2021-08-19 14:00:03'),
(1167, 1107, 'Florence Battery Model.jpeg', '2021-08-19 15:41:14', '2021-08-19 15:41:14'),
(1168, 1107, 'LTFlorence Battery Check.png', '2021-08-19 15:41:14', '2021-08-19 15:41:14'),
(1169, 1108, 'Kamuwongo gateway quotation 19-Aug.pdf', '2021-08-19 17:09:17', '2021-08-19 17:09:17'),
(1170, 746, 'Quote_1330_from_Husky_Outdoor_Equipment_Limited__KE.pdf', '2021-08-20 12:27:29', '2021-08-20 12:27:29'),
(1171, 746, 'powersaw quote 3.pdf', '2021-08-20 12:30:39', '2021-08-20 12:30:39'),
(1172, 1110, 'CamScanner 08-20-2021 16.22.pdf', '2021-08-20 16:26:35', '2021-08-20 16:26:35'),
(1173, 1111, 'CamScanner 08-23-2021 08.36.pdf', '2021-08-23 08:49:59', '2021-08-23 08:49:59'),
(1174, 1111, 'Stock Report.PNG', '2021-08-23 08:50:42', '2021-08-23 08:50:42'),
(1175, 1109, 'SAI.pdf', '2021-08-23 13:48:28', '2021-08-23 13:48:28'),
(1176, 1112, 'CamScanner 08-23-2021 13.37.pdf', '2021-08-23 14:17:30', '2021-08-23 14:17:30'),
(1177, 1113, 'CamScanner 08-23-2021 13.37.pdf', '2021-08-23 14:17:31', '2021-08-23 14:17:31'),
(1178, 1114, 'file.pdf', '2021-08-23 19:29:29', '2021-08-23 19:29:29'),
(1179, 1115, 'file(1).pdf', '2021-08-23 20:57:28', '2021-08-23 20:57:28'),
(1180, 1116, 'CamScanner 08-24-2021 09.51.pdf', '2021-08-24 10:16:46', '2021-08-24 10:16:46'),
(1181, 1117, 'BalancesOnCards (29).PDF', '2021-08-24 10:27:49', '2021-08-24 10:27:49'),
(1182, 1118, 'NESAK UPDATED QUOTE.pdf', '2021-08-24 11:27:13', '2021-08-24 11:27:13'),
(1183, 1119, 'Better Globe quote.pdf', '2021-08-24 11:55:23', '2021-08-24 11:55:23'),
(1184, 1005, 'urban 1.jpeg', '2021-08-24 11:57:21', '2021-08-24 11:57:21'),
(1185, 1120, 'CamScanner 08-24-2021 11.51.pdf', '2021-08-24 12:09:23', '2021-08-24 12:09:23'),
(1186, 1109, 'Technology today.pdf', '2021-08-24 12:59:08', '2021-08-24 12:59:08'),
(1187, 1109, 'DATA SOFT.pdf', '2021-08-24 12:59:22', '2021-08-24 12:59:22'),
(1188, 1091, 'Kasalu.pdf', '2021-08-24 15:50:47', '2021-08-24 15:50:47'),
(1189, 1121, 'Tents-Quote.pdf', '2021-08-25 11:24:25', '2021-08-25 11:24:25'),
(1190, 1121, 'Costing for Moving Tents.xlsx', '2021-08-25 11:27:24', '2021-08-25 11:27:24'),
(1191, 1114, 'Stock Form200821.xlsx', '2021-08-26 15:03:54', '2021-08-26 15:03:54'),
(1192, 1125, 'BETTER GLOBE 268X STEERING CYLINDER.pdf', '2021-08-27 09:41:00', '2021-08-27 09:41:00'),
(1193, 1125, 'KTCB356_DEMO.pdf', '2021-08-27 09:43:33', '2021-08-27 09:43:33'),
(1194, 1107, 'ELEVETUS FLO.pdf', '2021-08-27 15:21:33', '2021-08-27 15:21:33'),
(1195, 1107, 'Technology flo.pdf', '2021-08-27 15:21:51', '2021-08-27 15:21:51'),
(1196, 1126, 'FOD HRM OM IDEAL.jpg', '2021-08-27 16:29:41', '2021-08-27 16:29:41'),
(1197, 1126, 'FOD HRM OM HB TARDA.jpg', '2021-08-27 19:18:59', '2021-08-27 19:18:59'),
(1198, 1126, 'FOD HRM OM FB TARDA.jpg', '2021-08-27 19:20:48', '2021-08-27 19:20:48'),
(1199, 1127, 'WhatsApp Image 2021-08-31 at 12.22.07.jpeg', '2021-08-31 12:31:55', '2021-08-31 12:31:55'),
(1200, 1122, 'Tarda Haraka.jpg', '2021-09-01 09:17:33', '2021-09-01 09:17:33'),
(1201, 1122, 'ideal Haraka.jpg', '2021-09-01 09:18:15', '2021-09-01 09:18:15'),
(1202, 1131, 'BGF Painting works..pdf', '2021-09-01 14:53:33', '2021-09-01 14:53:33'),
(1203, 1006, 'Reality.pdf', '2021-09-01 15:50:32', '2021-09-01 15:50:32'),
(1204, 1006, 'COMPANY STAMP.jpg', '2021-09-01 15:52:14', '2021-09-01 15:52:14'),
(1205, 1132, 'quotation 01-Sep-2021 15-51-03.pdf', '2021-09-01 16:10:49', '2021-09-01 16:10:49'),
(1206, 1133, 'BETTER GLOBE20210901_14324064.pdf', '2021-09-01 16:46:33', '2021-09-01 16:46:33'),
(1207, 1130, 'IDEAL JOHN.jpg', '2021-09-01 20:19:53', '2021-09-01 20:19:53'),
(1208, 1121, 'TENTS COSTING.JPG', '2021-09-02 09:03:02', '2021-09-02 09:03:02'),
(1209, 1135, 'img20210818_14553640.pdf', '2021-09-02 10:47:20', '2021-09-02 10:47:20'),
(1210, 1136, 'Notice board push pins.jpg', '2021-09-02 14:09:11', '2021-09-02 14:09:11'),
(1211, 1137, 'IMG-20210902-WA0004_2.jpg', '2021-09-02 14:37:36', '2021-09-02 14:37:36'),
(1212, 825, 'BETTERGLOBE FORESTRY QUOTE FOR kyocera 2035 consumables  2021.doc', '2021-09-02 15:51:05', '2021-09-02 15:51:05'),
(1213, 1140, 'CamScanner 09-03-2021 09.37.pdf', '2021-09-03 10:00:13', '2021-09-03 10:00:13'),
(1214, 1141, 'BalancesOnCards (38).PDF', '2021-09-03 11:07:30', '2021-09-03 11:07:30'),
(1215, 1142, 'Capture 030921.PNG', '2021-09-03 11:22:40', '2021-09-03 11:22:40'),
(1216, 1142, 'Capture 13092021.PNG', '2021-09-03 11:22:40', '2021-09-03 11:22:40'),
(1217, 1144, 'Pipe fittings Quotations.ods', '2021-09-03 13:11:02', '2021-09-03 13:11:02'),
(1218, 1145, 'Pipe fittings Quotations.ods', '2021-09-03 13:11:04', '2021-09-03 13:11:04'),
(1219, 1147, 'PDF Scanner 04-09-21 12.44.28.pdf', '2021-09-06 05:48:58', '2021-09-06 05:48:58'),
(1220, 1147, 'LIST OF STAFF TO GET GUMBOOTS.docx', '2021-09-06 05:53:48', '2021-09-06 05:53:48'),
(1221, 1149, 'Notice board push pins.jpg', '2021-09-06 10:18:47', '2021-09-06 10:18:47'),
(1222, 1151, 'BalancesOnCards (36).PDF', '2021-09-06 11:05:11', '2021-09-06 11:05:11'),
(1223, 1152, 'qoutation 1.PDF', '2021-09-06 11:23:36', '2021-09-06 11:23:36'),
(1224, 1153, 'qoutation 2.PDF', '2021-09-06 11:37:53', '2021-09-06 11:37:53'),
(1225, 1154, 'Proforma Invoice.pdf', '2021-09-06 11:51:41', '2021-09-06 11:51:41'),
(1226, 1134, 'Tarda Haraka.jpg', '2021-09-06 12:13:12', '2021-09-06 12:13:12'),
(1227, 1134, 'ideal Haraka.jpg', '2021-09-06 12:13:28', '2021-09-06 12:13:28'),
(1228, 1156, 'qoutation 2.PDF', '2021-09-06 13:04:21', '2021-09-06 13:04:21'),
(1229, 1145, 'plumbing.jpg', '2021-09-06 13:27:21', '2021-09-06 13:27:21'),
(1230, 1142, 'Finance stamp.pdf', '2021-09-06 14:22:51', '2021-09-06 14:22:51'),
(1231, 1157, 'better Globe forestry doc.docx', '2021-09-06 14:40:21', '2021-09-06 14:40:21'),
(1232, 1143, 'Holiday inn.docx', '2021-09-06 15:03:48', '2021-09-06 15:03:48'),
(1233, 1140, 'Stock Form300821.xlsx', '2021-09-06 17:56:32', '2021-09-06 17:56:32'),
(1234, 1148, 'PDF Scanner 07-09-21 11.33.52.pdf', '2021-09-07 11:59:02', '2021-09-07 11:59:02'),
(1235, 1149, 'PDF Scanner 07-09-21 11.34.08.pdf', '2021-09-07 12:05:28', '2021-09-07 12:05:28'),
(1236, 1158, 'JAYMPET VENTURES ENTERPRISES_QUOTATION.pdf', '2021-09-07 22:57:00', '2021-09-07 22:57:00'),
(1237, 1159, 'CamScanner 09-07-2021 16.38.pdf', '2021-09-08 08:57:38', '2021-09-08 08:57:38'),
(1238, 1160, 'CamScanner 09-07-2021 16.41.pdf', '2021-09-08 09:09:16', '2021-09-08 09:09:16'),
(1239, 1162, 'CamScanner 09-07-2021 16.38 (1).pdf', '2021-09-08 10:55:02', '2021-09-08 10:55:02'),
(1240, 1161, 'CamScanner 09-07-2021 16.40.pdf', '2021-09-08 11:06:27', '2021-09-08 11:06:27'),
(1241, 1164, 'Stock as at September 2021.xlsx', '2021-09-08 15:56:31', '2021-09-08 15:56:31'),
(1242, 1165, 'PDF Scanner 09-09-21 10.41.14.pdf', '2021-09-09 10:53:57', '2021-09-09 10:53:57'),
(1243, 1167, 'Toyota Quote 2.pdf', '2021-09-09 12:01:04', '2021-09-09 12:01:04'),
(1244, 1168, 'Toyota Quote 3.pdf', '2021-09-09 12:10:55', '2021-09-09 12:10:55'),
(1245, 1169, 'Toyota Quote 4.pdf', '2021-09-09 12:21:33', '2021-09-09 12:21:33'),
(1246, 1170, 'Toyota Quote 5.pdf', '2021-09-09 12:30:23', '2021-09-09 12:30:23'),
(1247, 1171, 'Toyota Quote 6.pdf', '2021-09-09 12:46:40', '2021-09-09 12:46:40'),
(1248, 1172, 'Toyota Quote 7.pdf', '2021-09-09 12:53:25', '2021-09-09 12:53:25'),
(1250, 1174, 'Kamburu Quotation 88 2021.PDF', '2021-09-09 14:21:04', '2021-09-09 14:21:04'),
(1251, 1175, 'tOYOTA Quote 9.pdf', '2021-09-09 14:24:12', '2021-09-09 14:24:12'),
(1252, 1176, 'Toyota Quote 10.pdf', '2021-09-09 14:33:28', '2021-09-09 14:33:28'),
(1253, 1177, 'IMG-20210909-WA0022.jpg', '2021-09-09 14:43:13', '2021-09-09 14:43:13'),
(1254, 1167, 'part 2.pdf', '2021-09-09 14:50:04', '2021-09-09 14:50:04'),
(1255, 1179, 'Toyota Quote 11b.pdf', '2021-09-09 14:51:57', '2021-09-09 14:51:57'),
(1256, 1166, 'part 1.pdf', '2021-09-09 14:52:14', '2021-09-09 14:52:14'),
(1257, 1166, 'part 2.pdf', '2021-09-09 14:52:37', '2021-09-09 14:52:37'),
(1258, 1181, 'Toyota Quote 12 b.pdf', '2021-09-09 15:04:41', '2021-09-09 15:04:41'),
(1259, 1182, 'CamScanner 09-09-2021 15.01.pdf', '2021-09-09 15:05:47', '2021-09-09 15:05:47'),
(1260, 1173, 'bb.pdf', '2021-09-09 15:17:48', '2021-09-09 15:17:48'),
(1261, 1183, 'Toyota Quote 13b.pdf', '2021-09-09 15:36:52', '2021-09-09 15:36:52'),
(1262, 1179, 'c.pdf', '2021-09-09 15:42:56', '2021-09-09 15:42:56'),
(1263, 1181, 'd.pdf', '2021-09-09 15:49:43', '2021-09-09 15:49:43'),
(1264, 1183, 'e.pdf', '2021-09-09 15:59:49', '2021-09-09 15:59:49'),
(1265, 1184, 'Toyota Quote 14b.pdf', '2021-09-09 16:21:10', '2021-09-09 16:21:10'),
(1266, 1184, 'k.pdf', '2021-09-09 16:27:10', '2021-09-09 16:27:10'),
(1267, 1185, 'Kamburu Quotation 88 2021.PDF', '2021-09-09 17:52:01', '2021-09-09 17:52:01'),
(1268, 1186, 'Kamburu Quotation 88 2021.PDF', '2021-09-09 18:01:10', '2021-09-09 18:01:10'),
(1269, 1186, 'Kamburu Debit note 20 2021.pdf', '2021-09-09 18:03:00', '2021-09-09 18:03:00'),
(1270, 1187, 'Inverter casing Quotation.pdf', '2021-09-10 09:06:38', '2021-09-10 09:06:38'),
(1271, 1187, 'Inverter Casing Sketch.pdf', '2021-09-10 09:09:17', '2021-09-10 09:09:17'),
(1272, 1188, 'Mobile toilet Quotation.pdf', '2021-09-10 09:24:27', '2021-09-10 09:24:27'),
(1273, 1188, 'Mobile Toilet Frame.pdf', '2021-09-10 09:26:28', '2021-09-10 09:26:28'),
(1274, 1189, 'Fuel Quotation for 7F.pdf', '2021-09-10 13:01:45', '2021-09-10 13:01:45'),
(1275, 1190, 'Toyota Quote 15b.pdf', '2021-09-10 14:32:36', '2021-09-10 14:32:36'),
(1276, 1191, 'Toyota Quote 16b.pdf', '2021-09-10 14:43:46', '2021-09-10 14:43:46'),
(1277, 1191, 'Toyota Quote 16a.pdf', '2021-09-10 14:49:12', '2021-09-10 14:49:12'),
(1278, 1190, 'Toyta Quote 15a.pdf', '2021-09-10 14:49:50', '2021-09-10 14:49:50'),
(1279, 1192, 'Toyota 17b.pdf', '2021-09-10 15:08:24', '2021-09-10 15:08:24'),
(1280, 1192, 'Toyota 17.pdf', '2021-09-10 15:08:59', '2021-09-10 15:08:59'),
(1281, 1193, 'Toyota 18b.pdf', '2021-09-10 15:22:25', '2021-09-10 15:22:25'),
(1282, 1193, 'Toyota 18.pdf', '2021-09-10 15:23:22', '2021-09-10 15:23:22'),
(1283, 1194, 'Toota 19b.pdf', '2021-09-10 15:35:33', '2021-09-10 15:35:33'),
(1284, 1194, 'Toyota 19.pdf', '2021-09-10 15:36:09', '2021-09-10 15:36:09'),
(1285, 1195, 'CamScanner 09-12-2021 18.24.pdf', '2021-09-12 18:33:26', '2021-09-12 18:33:26'),
(1286, 1196, 'Diesel_Sept_October.pdf', '2021-09-12 21:13:47', '2021-09-12 21:13:47'),
(1287, 1197, 'file(13).pdf', '2021-09-12 22:23:26', '2021-09-12 22:23:26'),
(1288, 1197, 'CamScanner 09-13-2021 09.53.pdf', '2021-09-13 09:57:31', '2021-09-13 09:57:31'),
(1289, 1199, 'MOTORBIKE-REPAIRS-TUBES&TYRES_YAMAHA.pdf', '2021-09-13 12:00:13', '2021-09-13 12:00:13'),
(1290, 1201, 'New Document(29) 13-Sep-2021 12-36-41.pdf', '2021-09-13 13:27:02', '2021-09-13 13:27:02'),
(1291, 1202, 'Fuel Quotation for 7F.pdf', '2021-09-13 13:27:15', '2021-09-13 13:27:15'),
(1292, 1203, 'Fuel Quotation for 7F.pdf', '2021-09-13 13:31:16', '2021-09-13 13:31:16'),
(1293, 1203, 'Fuel consumption for August 2021.pdf', '2021-09-13 13:33:08', '2021-09-13 13:33:08'),
(1294, 1149, 'Stock requisition form for stationary 210913.xlsx', '2021-09-13 16:36:14', '2021-09-13 16:36:14'),
(1295, 1204, 'file(14).pdf', '2021-09-14 13:16:42', '2021-09-14 13:16:42'),
(1296, 1205, 'jacaranda Quote.pdf', '2021-09-14 14:40:37', '2021-09-14 14:40:37'),
(1297, 1206, 'CamScanner 09-14-2021 14.48.pdf', '2021-09-14 15:00:59', '2021-09-14 15:00:59'),
(1298, 1207, 'CamScanner 09-14-2021 17.05.pdf', '2021-09-14 17:06:16', '2021-09-14 17:06:16'),
(1299, 1208, 'PDF Scanner 07-09-21 11.34.08.pdf', '2021-09-15 08:15:21', '2021-09-15 08:15:21'),
(1300, 1209, 'PDF Scanner 07-09-21 11.34.08.pdf', '2021-09-15 08:29:28', '2021-09-15 08:29:28'),
(1301, 1209, 'Stock requisition form for stationary 210913.xlsx', '2021-09-15 08:29:28', '2021-09-15 08:29:28'),
(1302, 1211, 'GK 7Forks Field Visit 210915.xlsx', '2021-09-15 10:10:09', '2021-09-15 10:10:09'),
(1304, 1213, 'WhatsApp Image 2021-09-14 at 16.37.06.jpeg', '2021-09-15 10:48:18', '2021-09-15 10:48:18'),
(1305, 1214, 'WhatsApp Image 2021-09-15 at 10.07.26.jpeg', '2021-09-15 10:56:15', '2021-09-15 10:56:15'),
(1306, 1216, 'D6M Repairs.pdf', '2021-09-16 00:23:55', '2021-09-16 00:23:55'),
(1307, 1217, 'Slasher Blade-Welding.pdf', '2021-09-16 00:30:47', '2021-09-16 00:30:47'),
(1308, 1211, 'WhatsApp Image 2021-09-16 at 10.41.56.jpeg', '2021-09-16 11:33:24', '2021-09-16 11:33:24'),
(1310, 1198, 'BetterGlobeForestry1509RWR00.pdf', '2021-09-16 11:42:43', '2021-09-16 11:42:43'),
(1311, 1186, 'GIC FUEL CONSUMPTION FORMS.pdf', '2021-09-16 13:11:43', '2021-09-16 13:11:43'),
(1312, 1218, 'Alex.jpg', '2021-09-16 14:01:50', '2021-09-16 14:01:50'),
(1313, 1219, 'CamScanner 09-16-2021 08.24.pdf', '2021-09-16 14:05:25', '2021-09-16 14:05:25'),
(1314, 1219, 'Stock Form100921.xlsx', '2021-09-16 14:08:11', '2021-09-16 14:08:11'),
(1315, 1198, 'WEBCAM.pdf', '2021-09-16 14:27:25', '2021-09-16 14:27:25'),
(1316, 1147, 'PDF Scanner 16-09-21 10.03.27.pdf', '2021-09-16 14:41:54', '2021-09-16 14:41:54'),
(1317, 1220, 'JAN.PDF', '2021-09-16 14:46:12', '2021-09-16 14:46:12'),
(1318, 1210, 'BetterGlobeForestry1609RWR00.pdf', '2021-09-16 14:52:04', '2021-09-16 14:52:04'),
(1319, 1221, 'CamScanner 09-16-2021 14.39.pdf', '2021-09-16 14:57:34', '2021-09-16 14:57:34'),
(1320, 1221, 'DRILL_PHOTO.pdf', '2021-09-16 15:09:30', '2021-09-16 15:09:30'),
(1321, 1222, 'Q-112837 - BETTER GLOBE FORESTRY LTD. - 13_09_2021.pdf', '2021-09-17 08:51:51', '2021-09-17 08:51:51'),
(1322, 1222, 'CamScanner 09-17-2021 08.36.pdf', '2021-09-17 08:59:22', '2021-09-17 08:59:22'),
(1323, 1223, 'CamScanner 09-17-2021 09.08.pdf', '2021-09-17 09:13:01', '2021-09-17 09:13:01'),
(1324, 1225, 'KCF 189M Balance.PDF', '2021-09-17 11:57:01', '2021-09-17 11:57:01'),
(1325, 1226, 'CamScanner 09-17-2021 15.49.pdf', '2021-09-17 16:08:21', '2021-09-17 16:08:21'),
(1326, 1206, 'STOCK FORM REPORT KIA 7F-September - Copy.xlsx', '2021-09-17 16:21:58', '2021-09-17 16:21:58'),
(1327, 1228, 'Bucket plus mob.pdf', '2021-09-17 16:40:57', '2021-09-17 16:40:57'),
(1328, 1159, 'Mobile Toilet Frame (1).pdf', '2021-09-20 10:31:20', '2021-09-20 10:31:20'),
(1329, 1230, 'CamScanner 09-20-2021 10.46.pdf', '2021-09-20 10:57:23', '2021-09-20 10:57:23'),
(1330, 1230, 'CamScanner 09-20-2021 10.55.pdf', '2021-09-20 11:12:11', '2021-09-20 11:12:11'),
(1331, 1231, 'Picture 2.jpg', '2021-09-20 11:23:55', '2021-09-20 11:23:55'),
(1332, 1231, 'Quotation 200921.pdf', '2021-09-20 11:24:39', '2021-09-20 11:24:39'),
(1333, 1232, 'Hand Sanitizer Quotation.pdf', '2021-09-20 11:24:54', '2021-09-20 11:24:54'),
(1334, 1233, 'Hand Sanitizer Quotation.pdf', '2021-09-20 11:27:16', '2021-09-20 11:27:16'),
(1335, 1233, 'WK 37 STOCK FORM REPORT KIA 7F-September .xlsx', '2021-09-20 12:14:48', '2021-09-20 12:14:48'),
(1336, 1232, 'WK 37 STOCK FORM REPORT KIA 7F-September .xlsx', '2021-09-20 12:16:15', '2021-09-20 12:16:15'),
(1337, 1229, 'PDF Scanner 20-09-21 1.03.03.pdf', '2021-09-20 14:10:26', '2021-09-20 14:10:26'),
(1338, 1229, 'Stock requisition form for stationary 210913.xlsx', '2021-09-20 14:10:26', '2021-09-20 14:10:26'),
(1339, 1234, 'Quote 1.pdf', '2021-09-20 14:12:09', '2021-09-20 14:12:09'),
(1340, 1235, 'Quote 2.pdf', '2021-09-20 14:13:46', '2021-09-20 14:13:46'),
(1341, 1236, 'Solar svs quote.pdf', '2021-09-20 14:36:50', '2021-09-20 14:36:50'),
(1342, 1212, 'stocklevels HO.xlsx', '2021-09-20 17:27:45', '2021-09-20 17:27:45'),
(1343, 1237, 'Invoice MITI 52 design.pdf', '2021-09-21 10:00:45', '2021-09-21 10:00:45'),
(1344, 1238, 'Toyota 5b.pdf', '2021-09-21 12:31:38', '2021-09-21 12:31:38'),
(1345, 1239, 'Toyota 16B.pdf', '2021-09-21 12:46:43', '2021-09-21 12:46:43'),
(1346, 1213, 'ideal Palace.pdf', '2021-09-21 14:18:51', '2021-09-21 14:18:51'),
(1347, 1241, 'Quote Ramco1.pdf', '2021-09-21 14:22:12', '2021-09-21 14:22:12'),
(1348, 1243, 'file(15).pdf', '2021-09-22 14:12:33', '2021-09-22 14:12:33'),
(1349, 1242, 'QOUTE no 03-2021 - Better Globe Forestry .xlsx - Invoice Template.pdf', '2021-09-22 15:36:23', '2021-09-22 15:36:23'),
(1350, 1245, 'Tree measurement tools pictures for reference.docx', '2021-09-22 15:52:32', '2021-09-22 15:52:32'),
(1351, 1246, 'Drone Training Quote.pdf', '2021-09-22 20:41:12', '2021-09-22 20:41:12'),
(1352, 1246, 'Medical Test.JPG', '2021-09-22 20:42:49', '2021-09-22 20:42:49'),
(1353, 1247, 'BETTER GLOBE FORESTRY_NAIROBI SAFETY.pdf', '2021-09-23 08:40:56', '2021-09-23 08:40:56'),
(1354, 1248, 'anto.pdf', '2021-09-23 09:06:43', '2021-09-23 09:06:43'),
(1355, 1248, 'anto 1.jpg', '2021-09-23 09:08:00', '2021-09-23 09:08:00'),
(1356, 1248, 'anto 2.jpg', '2021-09-23 09:12:51', '2021-09-23 09:12:51'),
(1357, 1212, 'Stock As At 1st to 20th September 2021.xlsx', '2021-09-23 10:56:32', '2021-09-23 10:56:32'),
(1358, 1250, 'Toyota kenya Gloves Quotation.pdf', '2021-09-23 12:32:40', '2021-09-23 12:32:40'),
(1359, 1251, 'CamScanner 09-23-2021 15.38.pdf', '2021-09-23 15:43:54', '2021-09-23 15:43:54'),
(1360, 1251, 'WK 37 STOCK FORM REPORT KIA 7F-September .xlsx', '2021-09-23 16:01:54', '2021-09-23 16:01:54'),
(1361, 1253, 'PDF Scanner 24-09-21 9.55.04.pdf', '2021-09-24 09:58:41', '2021-09-24 09:58:41'),
(1362, 1253, 'FIRST AID SUPPLIES CHECKLIST DOKOLO updated.xlsx', '2021-09-24 10:06:03', '2021-09-24 10:06:03'),
(1363, 1255, 'CamScanner 09-24-2021 14.56 (1).pdf', '2021-09-24 15:04:51', '2021-09-24 15:04:51'),
(1364, 1240, 'CamScanner 09-24-2021.pdf', '2021-09-24 20:21:04', '2021-09-24 20:21:04'),
(1365, 1257, 'BETTER GLOBEVFORESTRY .pdf', '2021-09-25 07:05:41', '2021-09-25 07:05:41'),
(1366, 1258, 'Control Room Materials.pdf', '2021-09-27 09:23:10', '2021-09-27 09:23:10'),
(1367, 1259, 'Control Room Materials.pdf', '2021-09-27 09:23:20', '2021-09-27 09:23:20'),
(1368, 1233, 'WK 38 STOCK FORM REPORT KIA 7F-September .xlsx', '2021-09-27 10:41:33', '2021-09-27 10:41:33'),
(1369, 1251, 'Fuel Consumption Kiambere.pdf', '2021-09-27 12:29:42', '2021-09-27 12:29:42'),
(1370, 1252, 'file.pdf', '2021-09-27 12:42:03', '2021-09-27 12:42:03'),
(1371, 1262, 'Paints Quotation.pdf', '2021-09-27 12:55:42', '2021-09-27 12:55:42'),
(1372, 1263, 'PDF Scanner 27-09-21 11.30.03.pdf', '2021-09-27 14:52:20', '2021-09-27 14:52:20'),
(1373, 1264, 'CamScanner 09-27-2021 17.44.pdf', '2021-09-27 17:52:26', '2021-09-27 17:52:26'),
(1374, 1264, 'Tissue paper Quotation.pdf', '2021-09-27 17:53:44', '2021-09-27 17:53:44'),
(1375, 1265, 'Padlock_Quote.pdf', '2021-09-27 20:07:48', '2021-09-27 20:07:48'),
(1376, 1266, 'CamScanner 09-28-2021 09.36.pdf', '2021-09-28 09:44:21', '2021-09-28 09:44:21'),
(1377, 1267, 'CamScanner 09-28-2021 09.54.pdf', '2021-09-28 10:05:50', '2021-09-28 10:05:50'),
(1378, 1264, 'WK 38 STOCK FORM REPORT KIA 7F-September .xlsx', '2021-09-28 15:05:27', '2021-09-28 15:05:27'),
(1379, 1268, 'OCT4-8-RFQ-BetterGlobe.pdf', '2021-09-28 15:27:55', '2021-09-28 15:27:55'),
(1380, 1233, 'WK 38 STOCK FORM REPORT KIA 7F-September .xlsx', '2021-09-28 15:37:51', '2021-09-28 15:37:51'),
(1381, 1269, 'JAN latest.PDF', '2021-09-28 15:48:05', '2021-09-28 15:48:05'),
(1382, 1270, 'Tissue paper Quotation.pdf', '2021-09-28 16:02:39', '2021-09-28 16:02:39'),
(1383, 1270, 'WK 38 STOCK FORM REPORT KIA 7F-September .xlsx', '2021-09-28 16:06:03', '2021-09-28 16:06:03'),
(1384, 1269, 'JP PAYMENTS.docx', '2021-09-28 16:22:58', '2021-09-28 16:22:58'),
(1385, 1271, 'Better Globe Forestry quotation repair ofintercoms .docx', '2021-09-29 08:33:03', '2021-09-29 08:33:03'),
(1386, 1272, 'KCF 189M.PDF', '2021-09-29 14:06:45', '2021-09-29 14:06:45'),
(1387, 1275, 'Quote.jpeg', '2021-09-30 10:01:55', '2021-09-30 10:01:55'),
(1388, 1276, 'Quote 2.jpeg', '2021-09-30 10:05:25', '2021-09-30 10:05:25'),
(1389, 1261, 'WEBCAM SAI.pdf', '2021-09-30 12:25:38', '2021-09-30 12:25:38'),
(1390, 1280, 'Copy of BETTERGLOBE FORESTRY KCF 189M J23226B.xlsx', '2021-10-01 14:53:09', '2021-10-01 14:53:09'),
(1391, 1280, 'Qoute ETTERGLOBE FORESTRY KCF 189M J23226B (002).xlsx', '2021-10-01 16:41:16', '2021-10-01 16:41:16'),
(1392, 1282, 'CamScanner 10-02-2021 12.05.pdf', '2021-10-02 12:43:48', '2021-10-02 12:43:48'),
(1393, 1282, 'Stock Form021021.xlsx', '2021-10-02 12:45:47', '2021-10-02 12:45:47'),
(1394, 1283, 'New Document(39) 02-Oct-2021 14-15-59(1).pdf', '2021-10-02 16:49:31', '2021-10-02 16:49:31'),
(1395, 1180, 'SLEEVELESS JACKETS.docx', '2021-10-02 17:46:29', '2021-10-02 17:46:29'),
(1396, 1284, 'PHOTO-W-Drill Bits-Fence.pdf', '2021-10-03 16:37:46', '2021-10-03 16:37:46'),
(1397, 1284, 'U-Nails-FenceQuote.pdf', '2021-10-03 16:48:29', '2021-10-03 16:48:29'),
(1398, 1282, 'Issuance Book-Petrol2021.pdf', '2021-10-04 09:27:18', '2021-10-04 09:27:18'),
(1399, 1180, 'Nairobi safety quote.pdf', '2021-10-04 12:22:46', '2021-10-04 12:22:46'),
(1400, 1245, 'Solutech.pdf', '2021-10-04 14:05:25', '2021-10-04 14:05:25'),
(1401, 1245, 'Science scope.pdf', '2021-10-04 14:05:40', '2021-10-04 14:05:40'),
(1402, 1249, 'Office Catalogue 2021_23SEP2021.pdf', '2021-10-04 15:17:09', '2021-10-04 15:17:09'),
(1403, 1281, 'Kasalu Paint Quotation.pdf', '2021-10-04 16:14:48', '2021-10-04 16:14:48'),
(1404, 1285, 'insurance invoice.pdf', '2021-10-06 11:02:59', '2021-10-06 11:02:59'),
(1405, 1286, 'Cement.pdf', '2021-10-06 13:27:28', '2021-10-06 13:27:28'),
(1406, 1286, 'Cement.pdf', '2021-10-06 13:28:00', '2021-10-06 13:28:00'),
(1407, 1286, 'Cement.pdf', '2021-10-06 13:29:30', '2021-10-06 13:29:30'),
(1408, 1245, 'Quotation No. 6678 Kenya - Better Globe Forestry 04.10.2021 (004).pdf', '2021-10-06 14:20:24', '2021-10-06 14:20:24'),
(1409, 1287, 'Copy of Weekly Stock Sheet_ (002).xlsx', '2021-10-06 14:42:25', '2021-10-06 14:42:25'),
(1410, 1288, 'New Document(42) 07-Oct-2021 13-15-04.pdf', '2021-10-07 13:23:21', '2021-10-07 13:23:21'),
(1411, 1289, 'PDF Scanner 07-10-21 1.35.44.pdf', '2021-10-07 13:38:53', '2021-10-07 13:38:53'),
(1412, 1290, 'CamScanner 10-11-2021 12.25 (1).pdf', '2021-10-11 12:31:13', '2021-10-11 12:31:13'),
(1413, 1288, 'CHANGING ROOM COSTING.xlsx', '2021-10-12 09:44:51', '2021-10-12 09:44:51'),
(1414, 1288, 'CHANGING ROOM SKETCH.pdf', '2021-10-12 09:44:51', '2021-10-12 09:44:51'),
(1415, 1289, 'CHANGING ROOM COSTING.xlsx', '2021-10-12 09:45:44', '2021-10-12 09:45:44'),
(1416, 1289, 'CHANGING ROOM SKETCH.pdf', '2021-10-12 09:45:44', '2021-10-12 09:45:44'),
(1417, 1278, 'BetterGlobeForestry1210RWR00.pdf', '2021-10-12 11:29:58', '2021-10-12 11:29:58'),
(1418, 1300, 'CamScanner 10-11-2021 12.25 (1).pdf', '2021-10-13 10:10:54', '2021-10-13 10:10:54'),
(1419, 1138, 'QUOTE MOTHERBOARD.pdf', '2021-10-13 11:15:52', '2021-10-13 11:15:52'),
(1420, 1278, 'HDMI Converter.pdf', '2021-10-13 20:44:28', '2021-10-13 20:44:28'),
(1421, 1249, 'Victoria furnitures.pdf', '2021-10-13 20:49:19', '2021-10-13 20:49:19'),
(1422, 1304, 'KCY.PDF', '2021-10-14 10:06:58', '2021-10-14 10:06:58'),
(1423, 1298, 'BETTERGLOBE  FORESTRY KCF 033F J23120-SERVICE ONLY.xlsx', '2021-10-14 12:47:03', '2021-10-14 12:47:03'),
(1424, 1278, '1.jpg', '2021-10-14 14:34:38', '2021-10-14 14:34:38'),
(1425, 1278, '1a.jpg', '2021-10-14 14:34:58', '2021-10-14 14:34:58'),
(1426, 1308, 'aa.jpg', '2021-10-14 16:01:43', '2021-10-14 16:01:43'),
(1427, 1311, 'Urban-View Hotel.JPG', '2021-10-15 11:33:55', '2021-10-15 11:33:55'),
(1428, 1312, 'Weekly Stock Sheet_ (002) (version 1).xlsb.xlsx', '2021-10-15 15:08:10', '2021-10-15 15:08:10'),
(1429, 1300, 'Clothes Changing Area Sketch.pdf', '2021-10-15 22:04:48', '2021-10-15 22:04:48'),
(1430, 1300, 'Clothes Changing Room Costings.ods', '2021-10-15 22:06:30', '2021-10-15 22:06:30'),
(1431, 1290, 'Toilet costing.xlsx', '2021-10-16 11:04:52', '2021-10-16 11:04:52'),
(1432, 1313, 'CamScanner 10-16-2021 19.46.pdf', '2021-10-16 19:57:13', '2021-10-16 19:57:13'),
(1433, 1314, 'CamScanner 10-16-2021 20.46.pdf', '2021-10-16 21:34:42', '2021-10-16 21:34:42'),
(1434, 1314, 'WK 41 STOCK FORM REPORT KIA 7F-OCTOBER 2021.xlsx', '2021-10-16 21:40:35', '2021-10-16 21:40:35'),
(1435, 1315, 'Fuel Consumption form GIC.pdf', '2021-10-17 08:24:57', '2021-10-17 08:24:57'),
(1436, 1316, 'Fuel Consumption form GIC.pdf', '2021-10-17 08:27:35', '2021-10-17 08:27:35'),
(1437, 1316, 'Kamburu Quote 70.pdf', '2021-10-17 08:29:44', '2021-10-17 08:29:44'),
(1438, 1250, 'Nairobi safety quote.pdf', '2021-10-18 11:58:39', '2021-10-18 11:58:39'),
(1439, 1250, 'Nairobi safety 1.jpg', '2021-10-18 11:58:52', '2021-10-18 11:58:52'),
(1440, 1250, 'Nairobi safety 2.jpg', '2021-10-18 11:59:08', '2021-10-18 11:59:08'),
(1441, 1250, 'Toyota 1.jpg', '2021-10-18 11:59:32', '2021-10-18 11:59:32'),
(1442, 1250, 'Toyota 2.jpg', '2021-10-18 12:00:15', '2021-10-18 12:00:15'),
(1443, 1301, 'Est_666_from_Capture_Solutions_Ltd_6944.pdf', '2021-10-18 13:47:39', '2021-10-18 13:47:39'),
(1444, 1317, 'Premier malindi.docx', '2021-10-18 14:12:37', '2021-10-18 14:12:37'),
(1445, 1318, 'xMtwapa Accomodation - KENDRONE-2021.pdf', '2021-10-19 08:59:13', '2021-10-19 08:59:13'),
(1446, 1319, 'CamScanner 10-19-2021 08.56.pdf', '2021-10-19 09:06:41', '2021-10-19 09:06:41'),
(1447, 1320, 'CamScanner 10-19-2021 08.56.pdf', '2021-10-19 09:12:08', '2021-10-19 09:12:08'),
(1448, 1299, 'Better Globe Forestry Quatation-Postal Hole Digger.docx.xlsx', '2021-10-19 11:34:16', '2021-10-19 11:34:16'),
(1449, 1303, 'Raha.jpg', '2021-10-19 12:04:12', '2021-10-19 12:04:12'),
(1450, 1303, 'Ring spanner.jpg', '2021-10-19 12:04:33', '2021-10-19 12:04:33'),
(1451, 1303, 'Box spanner.jpg', '2021-10-19 12:04:49', '2021-10-19 12:04:49'),
(1452, 1303, '142 pcs tool box.jpg', '2021-10-19 12:13:59', '2021-10-19 12:13:59'),
(1453, 1321, 'Quote Raha Hardware and Tools.jpeg', '2021-10-19 12:26:47', '2021-10-19 12:26:47'),
(1454, 1321, '142 pcs tool box.jpg', '2021-10-19 12:31:42', '2021-10-19 12:31:42'),
(1455, 1321, 'Box spanner.jpg', '2021-10-19 12:32:17', '2021-10-19 12:32:17'),
(1456, 1321, 'Ring spanner.jpg', '2021-10-19 12:32:29', '2021-10-19 12:32:29'),
(1457, 1320, 'CamScanner 10-19-2021 21.06.pdf', '2021-10-19 21:13:22', '2021-10-19 21:13:22'),
(1458, 1323, 'Mas Enterprise Quotation.pdf', '2021-10-19 21:32:38', '2021-10-19 21:32:38'),
(1459, 1322, 'Kasalu Quotation.pdf', '2021-10-19 22:00:14', '2021-10-19 22:00:14'),
(1460, 1325, 'file.pdf', '2021-10-21 08:11:41', '2021-10-21 08:11:41'),
(1461, 1329, 'PDF Scanner 21-10-21 1.34.42.pdf', '2021-10-21 14:02:23', '2021-10-21 14:02:23'),
(1462, 1329, 'IMG-20211014-WA0005.jpg', '2021-10-21 14:11:40', '2021-10-21 14:11:40'),
(1463, 1329, 'SUPPLIER QUOTE FOR SHADE NET.xlsx', '2021-10-21 14:11:40', '2021-10-21 14:11:40'),
(1464, 1332, 'Cash request form. - KIA- October 2021_.pdf', '2021-10-22 07:40:36', '2021-10-22 07:40:36'),
(1465, 1333, '#QUOTE-00121.pdf', '2021-10-22 13:48:02', '2021-10-22 13:48:02'),
(1466, 1334, 'KIAMBERE FUEL CONSUMPTION FORM.pdf', '2021-10-23 12:16:49', '2021-10-23 12:16:49'),
(1467, 1335, 'Accomodation-QUOTE.pdf', '2021-10-23 16:16:01', '2021-10-23 16:16:01'),
(1468, 1332, 'Tarda alex.jpg', '2021-10-23 17:53:10', '2021-10-23 17:53:10'),
(1469, 1324, 'Gallagher.pdf', '2021-10-24 12:41:10', '2021-10-24 12:41:10'),
(1470, 1334, 'FUEL QUOTATION.pdf', '2021-10-24 16:17:26', '2021-10-24 16:17:26'),
(1471, 1337, 'QUOTATION TARDA GAMBA.pdf', '2021-10-25 11:26:39', '2021-10-25 11:26:39'),
(1472, 1334, 'Fuel Consumption KIA.pdf', '2021-10-25 13:49:46', '2021-10-25 13:49:46'),
(1473, 1338, 'Tarda alex.jpg', '2021-10-25 15:23:11', '2021-10-25 15:23:11'),
(1474, 1340, 'CamScanner 09-20-2021 10.55 (1).pdf', '2021-10-25 22:18:20', '2021-10-25 22:18:20'),
(1475, 1340, 'Inverter Box Quotation(2).pdf', '2021-10-25 22:21:34', '2021-10-25 22:21:34'),
(1476, 1341, 'New Document(1) 25-Oct-2021 16-37-32.pdf', '2021-10-26 08:02:04', '2021-10-26 08:02:04'),
(1477, 1342, 'Better Globe Forestry Quatation-Postal Hole Digger.docx.xlsx', '2021-10-26 08:32:59', '2021-10-26 08:32:59'),
(1478, 1343, 'Water quote 1.pdf', '2021-10-26 09:01:41', '2021-10-26 09:01:41'),
(1479, 1343, 'Water quote 2.pdf', '2021-10-26 09:02:43', '2021-10-26 09:02:43'),
(1480, 1344, 'Tarda alex.jpg', '2021-10-26 11:06:52', '2021-10-26 11:06:52'),
(1481, 1348, 'Security Uniform Quotation .pdf', '2021-10-26 12:26:48', '2021-10-26 12:26:48'),
(1482, 1348, 'UNIFORM SIZES FOR THE NEW SECURITY GUARDS.ods', '2021-10-26 12:29:21', '2021-10-26 12:29:21'),
(1483, 1349, 'Ideal.jpg', '2021-10-26 14:05:34', '2021-10-26 14:05:34'),
(1484, 1350, 'Toyota Quote 3.pdf', '2021-10-26 14:41:19', '2021-10-26 14:41:19'),
(1485, 1351, 'Toyota Quote 24.pdf', '2021-10-26 15:01:57', '2021-10-26 15:01:57'),
(1486, 1352, 'LIQUID SOAP QUOTATION.pdf', '2021-10-26 23:19:36', '2021-10-26 23:19:36'),
(1487, 1353, 'LIQUID SOAP QUOTATION.pdf', '2021-10-26 23:21:49', '2021-10-26 23:21:49'),
(1488, 1352, 'WK 42 STOCK FORM REPORT KIA 7F-OCTOBER 2021.xlsx', '2021-10-26 23:25:09', '2021-10-26 23:25:09'),
(1489, 1353, 'WK 42 STOCK FORM REPORT KIA 7F-OCTOBER 2021.xlsx', '2021-10-26 23:26:38', '2021-10-26 23:26:38'),
(1490, 1355, 'Better Globe Forestry Quatation-Postal Hole Digger.docx.xlsx', '2021-10-27 11:37:00', '2021-10-27 11:37:00'),
(1491, 1356, 'Diamonds and Sandies Malindi_June-Dec 2021 Specials.pdf', '2021-10-27 14:01:49', '2021-10-27 14:01:49'),
(1492, 1357, 'Copy of Farm information sheet.xlsx', '2021-10-27 15:01:17', '2021-10-27 15:01:17'),
(1493, 1321, 'BETTER GLOBE QUOTATION 27.10.21.pdf', '2021-10-28 08:04:19', '2021-10-28 08:04:19'),
(1494, 1360, 'toyota 12.pdf', '2021-10-28 10:51:20', '2021-10-28 10:51:20'),
(1495, 1362, 'BASH BASH RESTAURANT-WITU_1.pdf', '2021-10-28 17:39:06', '2021-10-28 17:39:06'),
